date,site,category,title,url,publish_time,content
20260423,cnnpn_international,核电国外,俄罗斯国家原子能公司完成世界上第一个放射性废物焚烧项目4月22日，据塔斯社消息，俄罗斯国家原子能公司新闻处报道，该公司已完成世界上首个对反应堆中乏核燃料所含有害元素进行后燃的计划。2024年夏季，三组掺杂了次锕系元素(镅 - 241和镎 - 237)的MOX燃料组件被装入别洛亚尔斯克核电站4号机组(BN - 800反应堆)的堆芯，并成功完成运行周期。这些辐照后的燃料组件在乏燃料池冷却后，将被送去进行辐照后检验。次锕系元素指除钚以外，在核反应堆运行过程中于核燃料中形成的一组元素，主要包括镎、镅和锔。它...2026-04-23,https://www.cnnpn.cn/article/53405.html,2026-04-23 00:00:00,
20260423,cnnpn_international,核电国外,美国能源部寻求与私营部门合作进行乏核燃料回收利用美国能源部核能办公室和环境管理办公室4月22日发布两份申请征集书(RFA)，旨在提升美国乏核燃料回收利用能力，此举支持特朗普总统加强美国核工业基础和能源独立的行政命令。美国核能部门发布的征求建议书(RFA)，旨在向业界征集详细方案，利用能源部授权流程，设计、建造和运营核燃料回收、加工和燃料制造设施，支持先进反应堆部署，加速美国在核材料回收技术领域创新。能源管理部门发布的征求建议书(RFA)，则向私营企业征集前瞻性方案，在爱达荷州核技...2026-04-23,https://www.cnnpn.cn/article/53403.html,2026-04-23 00:00:00,
20260423,cnnpn_international,核电国外,俄罗斯监管部门批准达尔马托夫斯克铀矿新装置建设俄罗斯核监管机构Rostekhnadzor颁发证书，证明达尔马托夫斯克铀矿上乌克西扬斯卡亚矿床的首个移动吸附装置已成功建造和安装。(图片来源：俄罗斯国家原子能公司)俄罗斯国家原子能公司(Rosatom)矿业部门旗下的达鲁尔股份公司(JSC Dalur)在该矿床建造了U - 14V作业装置，其中包含一个移动式吸附装置。该装置是一个由模块化容器组成的高科技综合体，涵盖吸附柱、溶液和吸附剂储罐、变电站和控制室等。设施还包括近2000米的工艺管道架空线和公用...2026-04-23,https://www.cnnpn.cn/article/53397.html,2026-04-23 00:00:00,
20260423,cnnpn_international,核电国外,美国核管会批准Kairos Power延长Hermes 1反应堆建设期限美国核管理委员会已批准Kairos Power的请求，将其Hermes 1示范反应堆施工许可证规定的竣工日期延长28个月。2023年12月，Kairos Power获得美国核管理委员会(NRC)颁发的赫尔墨斯1号熔盐冷却示范反应堆建造许可证，该反应堆位于田纳西州橡树岭的遗产中心工业园区，是50多年来美国首个获准建造的非水冷反应堆，许可证规定最迟于2026年12月31日完成建设。2024年7月，Kairos Power为其KP - FHR氟化物盐冷却高温反应堆技术的规模化示范项目破土动工，10...2026-04-23,https://www.cnnpn.cn/article/53395.html,2026-04-23 00:00:00,
20260423,cnnpn_international,核电国外,美国空军将在圣安东尼奥联合基地部署原型核微型反应堆美国空军部与国防创新部门合作，选定安塔瑞斯公司在圣安东尼奥联合基地部署原型核微型反应堆，此为先进核动力设施(ANPI)计划的一部分。依据计划，安塔瑞斯预计完成其R1微型反应堆的选址、许可、建设、运营和退役，目标在2028年或更早完成系统部署。R1是采用钠热管冷却的微型反应堆，使用坚固的三结构各向同性(TRISO)燃料。安塔瑞斯核电站可为设施供电，两次加料间可安全运行数年，且无需连接商业电网或专用基础设施即可部署。安塔瑞斯目前处于美...2026-04-23,https://www.cnnpn.cn/article/53394.html,2026-04-23 00:00:00,
20260423,cnnpn_international,核电国外,俄罗斯国家原子能公司完成世界上第一个放射性废物焚烧项目,https://www.cnnpn.cn/article/53405.html,,
20260423,cnnpn_international,核电国外,美国利用超级计算机训练AI模型捕捉等离子体磁湍流细节,https://www.cnnpn.cn/article/53343.html,,
20260423,cnnpn_international,核电国外,韩国开发出测量核电站设备大气腐蚀新技术,https://www.cnnpn.cn/article/53367.html,,
20260423,cnnpn_international,核电国外,Avalanche Energy获DARPA资助 研发核电池攻克聚变能转化难题,https://www.cnnpn.cn/article/53073.html,,
20260423,cnnpn_international,核电国外,AtkinsRéalis确认CANDU® Monark反应堆功率等级,https://www.cnnpn.cn/article/53336.html,,
20260423,cnnpn_international,核电国外,美国核材料公司推超长寿命固态核电池动力单元,https://www.cnnpn.cn/article/53128.html,,
20260423,cnnpn_international,核电国外,俄科研人员：月球用核能模块原型机将于2032年问世,https://www.cnnpn.cn/article/53023.html,,
20260423,cnnpn_international,核电国外,Terra Innovatum与Mersen成功生产石墨反应堆堆芯原型,https://www.cnnpn.cn/article/53204.html,,
20260423,cnnpn_international,核电国外,美国安塔瑞斯公司Mark - 0反应堆安全报告获批，试点项目推进,https://www.cnnpn.cn/article/53025.html,,
20260423,cnnpn_international,核电国外,Helion Energy：：聚变商用之路迎来关键挑战，材料技术攻坚瞄准“工程极限”,https://www.cnnpn.cn/article/52637.html,,
20260423,cnnpn_international,核电国外,切尔诺贝利核电站禁区森林可能将污染重新引入生物地球化学循环,https://www.cnnpn.cn/article/53406.html,,
20260423,cnnpn_international,核电国外,国际原子能机构向越南移交核电计划同行评审最终报告,https://www.cnnpn.cn/article/53410.html,,
20260423,cnnpn_international,核电国外,芬兰Steady Energy通讯和公共关系总监Lauri Muranen：到2050年芬兰将有20-30座小型核电站投入运营,https://www.cnnpn.cn/article/52864.html,,
20260423,cnnpn_international,核电国外,LS Materials获美国能源公司核聚变项目超级电容器订单,https://www.cnnpn.cn/article/53415.html,,
20260423,cnnpn_international,核电国外,日本核燃料公司提交低放射性废物处置相关申请,https://www.cnnpn.cn/article/53411.html,,
20260423,cpnn_energy,新能源,湖南送广东首次跨电网经营区中长期电力交易达成,https://cpnn.com.cn/news/xny/202604/t20260423_1883302.html,2026-04-23 00:00:00,
20260423,cpnn_energy,新能源,湖南送广东首次跨电网经营区中长期电力交易达成,http://www.cpnn.com.cn/news/xny/202604/t20260423_1883302.html,2026-04-23 00:00:00,
20260423,cpnn_tech,综合科技,黑磷快充电池，取得重要突破,https://cpnn.com.cn/news/kj/202604/t20260423_1883333.html,2026-04-23 00:00:00,
20260423,cpnn_tech,综合科技,中国光学超材料，取得新突破,https://cpnn.com.cn/news/kj/202604/t20260423_1883315.html,2026-04-23 00:00:00,
20260423,cpnn_tech,综合科技,新平台上线！可检测600余项新能源汽车电安全技术问题,https://cpnn.com.cn/news/kj/202604/t20260423_1883314.html,2026-04-23 00:00:00,
20260423,cpnn_tech,综合科技,成功拓宽至-120℃至60℃！我国团队攻克锂硫电池技术难题,https://cpnn.com.cn/news/kj/202604/t20260423_1883313.html,2026-04-23 00:00:00,
20260423,cpnn_tech,综合科技,6分钟、1500公里、2万亿元 中国新电池来了,https://cpnn.com.cn/news/kj/202604/t20260423_1883163.html,2026-04-23 00:00:00,
20260423,cpnn_tech,综合科技,黑磷快充电池，取得重要突破,http://www.cpnn.com.cn/news/kj/202604/t20260423_1883333.html,2026-04-23 00:00:00,
20260423,cpnn_tech,综合科技,中国光学超材料，取得新突破,http://www.cpnn.com.cn/news/kj/202604/t20260423_1883315.html,2026-04-23 00:00:00,
20260423,cpnn_tech,综合科技,新平台上线！可检测600余项新能源汽车电安全技术问题,http://www.cpnn.com.cn/news/kj/202604/t20260423_1883314.html,2026-04-23 00:00:00,
20260423,cpnn_tech,综合科技,成功拓宽至-120℃至60℃！我国团队攻克锂硫电池技术难题,http://www.cpnn.com.cn/news/kj/202604/t20260423_1883313.html,2026-04-23 00:00:00,
20260423,cpnn_tech,综合科技,6分钟、1500公里、2万亿元 中国新电池来了,http://www.cpnn.com.cn/news/kj/202604/t20260423_1883163.html,2026-04-23 00:00:00,
20260423,sciencenet,综合科技,全民早期预警中国方案“妈祖（MAZU）”支持40余国“云”上,https://news.sciencenet.cn/htmlnews/2026/4/563617.shtm,2026-04-23 00:00:00,
20260423,sciencenet,综合科技,世界最大规模宇宙学模拟“千衍”首批成果发布,https://news.sciencenet.cn/htmlnews/2026/4/563615.shtm,2026-04-23 00:00:00,
20260423,sciencenet,综合科技,巴西高安全级别实验室病毒样本被盗引发轩然大波,https://news.sciencenet.cn/htmlnews/2026/4/563614.shtm,2026-04-23 00:00:00,
20260423,sciencenet,综合科技,98%的肉奶制品可持续发展承诺属于“漂绿”行为,https://news.sciencenet.cn/htmlnews/2026/4/563612.shtm,2026-04-23 00:00:00,
20260423,sciencenet,综合科技,融合物理与数据驱动，水系统智能研究迎来新指南,https://news.sciencenet.cn/htmlnews/2026/4/563608.shtm,2026-04-23 00:00:00,
20260423,sciencenet,综合科技,胆汁酸代谢有望成为泌乳调控的核心靶点,https://news.sciencenet.cn/htmlnews/2026/4/563606.shtm,2026-04-23 00:00:00,
20260423,sciencenet,综合科技,高速运动不再糊！新算法实现快照压缩清晰重建,https://news.sciencenet.cn/htmlnews/2026/4/563604.shtm,2026-04-23 00:00:00,
20260423,sciencenet,综合科技,新型深度神经网络模型助力脑机接口应用,https://news.sciencenet.cn/htmlnews/2026/4/563602.shtm,2026-04-23 00:00:00,
20260423,sciencenet,综合科技,科学家首次构建单细胞分辨率耳蜗核空间转录组图谱,https://news.sciencenet.cn/htmlnews/2026/4/563598.shtm,2026-04-23 00:00:00,
20260423,sciencenet,综合科技,研究揭示2'3'-cGAMP介导的全新膜损伤机制,https://news.sciencenet.cn/htmlnews/2026/4/563597.shtm,2026-04-23 00:00:00,
20260423,sciencenet,综合科技,科学家揭示睡眠-觉醒状态转换中皮层星形胶质细胞体积调节机制,https://news.sciencenet.cn/htmlnews/2026/4/563594.shtm,2026-04-23 00:00:00,
20260423,sciencenet,综合科技,乒乓机器人战胜人类球手,https://news.sciencenet.cn/htmlnews/2026/4/563593.shtm,2026-04-23 00:00:00,
20260423,sciencenet,综合科技,古人三波迁徙 最终定居南美,https://news.sciencenet.cn/htmlnews/2026/4/563590.shtm,2026-04-23 00:00:00,
20260423,sciencenet,综合科技,全球森林植物多样性对土壤呼吸作用的影响机制被揭示,https://news.sciencenet.cn/htmlnews/2026/4/563584.shtm,2026-04-23 00:00:00,
20260423,sciencenet,综合科技,三星堆遗址绿松石制品来源研究获进展,https://news.sciencenet.cn/htmlnews/2026/4/563582.shtm,2026-04-23 00:00:00,
20260423,sciencenet,综合科技,“迷你肠道”中的益生菌靠丁酸激活肠道健康开关,https://news.sciencenet.cn/htmlnews/2026/4/563580.shtm,2026-04-23 00:00:00,
20260423,sciencenet,综合科技,科学家找到能提升生猪饲料效率的“天然开关”,https://news.sciencenet.cn/htmlnews/2026/4/563578.shtm,2026-04-23 00:00:00,
20260423,sciencenet,综合科技,高钙环境促微生物抱团 助喀斯特土壤碳氮增加,https://news.sciencenet.cn/htmlnews/2026/4/563577.shtm,2026-04-23 00:00:00,
20260423,sciencenet,综合科技,科学家发现细菌可以“爆炸”以传播抗生素耐药性,https://news.sciencenet.cn/htmlnews/2026/4/563575.shtm,2026-04-23 00:00:00,
20260423,sciencenet,综合科技,本科生团队建造暗物质探测器并设定新的实验限制,https://news.sciencenet.cn/htmlnews/2026/4/563574.shtm,2026-04-23 00:00:00,
20260423,sciencenet,综合科技,卵母细胞冷冻致胚胎阻滞机制获进展,https://news.sciencenet.cn/htmlnews/2026/4/563569.shtm,2026-04-23 00:00:00,
20260423,sciencenet,综合科技,黑磷快充电池关键技术获突破,https://news.sciencenet.cn/htmlnews/2026/4/563560.shtm,2026-04-23 00:00:00,
20260423,sciencenet,综合科技,全球开口最大光热熔盐槽式集热器成套装备及工艺完成技术验证,https://news.sciencenet.cn/htmlnews/2026/4/563558.shtm,2026-04-23 00:00:00,
20260423,sciencenet,综合科技,研究揭示厌氧细菌高效降解氯霉素的新机制,https://news.sciencenet.cn/htmlnews/2026/4/563554.shtm,2026-04-23 00:00:00,
20260423,sciencenet,综合科技,科学家提出“分步配位编辑”法制备铝基MOF膜,https://news.sciencenet.cn/htmlnews/2026/4/563541.shtm,2026-04-23 00:00:00,
20260423,sciencenet,综合科技,新研究实现脑回路的精确读取与控制,https://news.sciencenet.cn/htmlnews/2026/4/563534.shtm,2026-04-23 00:00:00,
20260423,xinhua_tech,综合科技,光学超材料也能“印”出来？中国科学家开创规模化制备新范式（组图）,https://www.news.cn/tech/20260423/d2353e89b132433ab8ff6a92906cbc02/c.html,2026-04-23 00:00:00,
20260423,xinhua_tech,综合科技,跨境支付互联互通再“上新” 五国支付二维码接入微信支付,https://www.news.cn/tech/20260423/90fb9b410afa48df8f6f7b45d5bf56f8/c.html,2026-04-23 00:00:00,
20260423,xinhua_tech,综合科技,我国科技人员揭秘44.8亿年的“太阳系活化石”,https://www.news.cn/tech/20260423/a0841d41deed431084786ea6a74184f9/c.html,2026-04-23 00:00:00,
20260423,xinhua_tech,综合科技,两办发文力推重点领域节能降碳,https://www.news.cn/tech/20260423/a32d7e1f583445939749ad541d05fe49/c.html,2026-04-23 00:00:00,
20260423,xinhua_tech,综合科技,全球未来科技竞赛热度不减,https://www.news.cn/tech/20260423/4ef9373830674ca89bf23311b4a410ad/c.html,2026-04-23 00:00:00,
20260423,xinhua_tech,综合科技,国家发改委：推动低空经济“管得好、飞得稳、用得活”,https://www.news.cn/tech/20260423/2f62eb1036984dd4b270b1e0572e3296/c.html,2026-04-23 00:00:00,
20260423,xinhua_tech,综合科技,国务院印发《关于推进服务业扩能提质的意见》,https://www.news.cn/tech/20260423/866a69d229494072945e37f8c9a71b6f/c.html,2026-04-23 00:00:00,
20260423,xinhua_tech,综合科技,月球新矿物第十一位成员“入列”,https://www.news.cn/tech/20260423/df326eb9c931425bb5c61663e94361e9/c.html,2026-04-23 00:00:00,
20260423,xinhua_tech,综合科技,解码商业航天的中国式强国之路,https://www.news.cn/tech/20260423/d58ca9d5fff045cf96492bc4375f8c68/c.html,2026-04-23 00:00:00,
20260423,inen_solar,光伏,事关新能源项目！中国能建城市发展公司与建筑集团开展交流座谈,https://solar.in-en.com/html/solar-2459743.shtml,2026-04-23 00:00:00,
20260423,inen_solar,光伏,安徽省能源局在芜湖市组织召开能源领域民营企业座谈会,https://solar.in-en.com/html/solar-2459746.shtml,2026-04-23 00:00:00,
20260423,inen_solar,光伏,2025年安徽省先进光伏和新型储能产业竞争力居全国第3位,https://solar.in-en.com/html/solar-2459753.shtml,2026-04-23 00:00:00,
20260423,inen_solar,光伏,零碳园区，游戏规则变了！高层多次“点名”到底意味着什么？,https://solar.in-en.com/html/solar-2459740.shtml,2026-04-23 00:00:00,
20260423,inen_solar,光伏,电力供应商Pinergy投资3500万欧元在爱尔兰扩大太阳能电力供应,https://solar.in-en.com/html/solar-2459739.shtml,2026-04-23 00:00:00,
20260423,inen_solar,光伏,十年来阿塞拜疆风能和太阳能装机显著增长,https://solar.in-en.com/html/solar-2459738.shtml,2026-04-23 00:00:00,
20260423,inen_solar,光伏,安曼发展走廊42公里太阳能照明项目启动,https://solar.in-en.com/html/solar-2459737.shtml,2026-04-23 00:00:00,
20260423,inen_solar,光伏,越南嘉莱省批准投建4个太阳能与风电项目,https://solar.in-en.com/html/solar-2459736.shtml,2026-04-23 00:00:00,
20260423,inen_solar,光伏,云南580MW光伏项目竞配启动,https://solar.in-en.com/html/solar-2459547.shtml,,
20260423,inen_solar,光伏,杨文斌：解构荒漠区光伏电产业与防沙治沙协同发展的新技术、问题,https://solar.in-en.com/html/solar-2459525.shtml,,
20260423,inen_solar,光伏,安徽宿州市：加快新能源集成融合发展，谋划申报绿电直连项目,https://solar.in-en.com/html/solar-2459527.shtml,,
20260423,inen_solar,光伏,开盘大涨84.61%！又一家千亿市值光伏上市企业诞生,https://solar.in-en.com/html/solar-2459534.shtml,,
20260423,inen_solar,光伏,晶澳科技于红伟：漠蓝组件重构沙戈荒光伏核心价值,https://solar.in-en.com/html/solar-2459546.shtml,,
20260423,inen_solar,光伏,本周多晶硅价格跌幅收窄 成交初现回暖,https://solar.in-en.com/html/solar-2459514.shtml,,
20260423,inen_solar,光伏,吉林省白城市政府一行到访中来并达成战略合作,https://solar.in-en.com/html/solar-2459552.shtml,,
20260423,inen_solar,光伏,华能澜沧江公司到华为技术有限公司交流学习并签署深化合作协议,https://solar.in-en.com/html/solar-2459523.shtml,,
20260423,inen_solar,光伏,中车时代电气：2000V光伏逆变器+3450kW储能PCS，沙戈荒大基地的,https://solar.in-en.com/html/solar-2459674.shtml,,
20260423,inen_solar,光伏,谈及清洁能源基地！温枢刚拜会湖北省委书记王忠林,https://solar.in-en.com/html/solar-2459672.shtml,,
20260423,inen_solar,光伏,青海国投与中广核青海公司举行战略合作签约仪式,https://solar.in-en.com/html/solar-2459669.shtml,,
20260423,renewablesnow,新能源,EU moves to unlock PPAs with new recommendations,https://renewablesnow.com/news/eu-moves-to-unlock-ppas-with-new-recommendations-1293611/,2026-04-23 00:00:00,
20260423,renewablesnow,新能源,"US distributed solar, storage firm Arena Renewables acquired by Headwater",https://renewablesnow.com/news/us-distributed-solar-storage-firm-arena-renewables-acquired-by-headwater-1293610/,2026-04-23 00:00:00,
20260423,renewablesnow,新能源,PAD RES building 133 MW of solar farms in southern Poland,https://renewablesnow.com/news/pad-res-building-133-mw-of-solar-farms-in-southern-poland-1293606/,2026-04-23 00:00:00,
20260423,renewablesnow,新能源,L&T Energy agrees green ammonia supply deal with ITOCHU,https://renewablesnow.com/news/lt-energy-agrees-green-ammonia-supply-deal-with-itochu-1293553/,2026-04-23 00:00:00,
20260423,renewablesnow,新能源,Nel bags USD-7m PEM electrolyser order from utility in Washington,https://renewablesnow.com/news/nel-bags-usd-7m-pem-electrolyser-order-from-utility-in-washington-1293547/,2026-04-23 00:00:00,
20260423,renewablesnow,新能源,SWM invests in German green hydrogen hub,https://renewablesnow.com/news/swm-invests-in-german-green-hydrogen-hub-1293508/,2026-04-23 00:00:00,
20260423,renewablesnow,新能源,Italy's Limes lands enviro approval for 150-MW BESS project in Chile,https://renewablesnow.com/news/italys-limes-lands-enviro-approval-for-150-mw-bess-project-in-chile-1293615/,2026-04-23 00:00:00,
20260423,renewablesnow,新能源,AllianzGI buys 51% stake in German energy storage firm GESI,https://renewablesnow.com/news/allianzgi-buys-51-percent-stake-in-german-energy-storage-firm-gesi-1293604/,2026-04-23 00:00:00,
20260423,renewablesnow,新能源,FP Lux fund adds another battery to portfolio with 95-MW Finnish deal,https://renewablesnow.com/news/fp-lux-fund-adds-another-battery-to-portfolio-with-95-mw-finnish-deal-1293592/,2026-04-23 00:00:00,
20260423,renewablesnow,新能源,GE Vernova books orders for 71.5 MW of onshore wind turbines in Germany,https://renewablesnow.com/news/ge-vernova-books-orders-for-71-5-mw-of-onshore-wind-turbines-in-germany-1293602/,2026-04-23 00:00:00,
20260423,renewablesnow,新能源,RWE commissions 36-MW Camster II wind farm in Scotland,https://renewablesnow.com/news/rwe-commissions-36-mw-camster-ii-wind-farm-in-scotland-1293589/,2026-04-23 00:00:00,
20260423,renewablesnow,新能源,Enercon inks agreement for 440-MW-plus turbine supply to Canada,https://renewablesnow.com/news/enercon-inks-agreement-for-440-mw-plus-turbine-supply-to-canada-1293554/,2026-04-23 00:00:00,
20260423,renewablesnow,新能源,Five European TSOs to study North Sea offshore cable cooperation,https://renewablesnow.com/news/five-european-tsos-to-study-north-sea-offshore-cable-cooperation-1293569/,2026-04-23 00:00:00,
20260423,solarbe_tech,光伏,拟募资245亿！华润新能源IPO下周上会,https://news.solarbe.com/202604/23/50022208.html,2026-04-23 00:00:00,
20260423,solarbe_tech,光伏,30亿定增预案出炉 加码光伏浆料及芯片封测赛道,https://news.solarbe.com/202604/23/50022189.html,2026-04-23 00:00:00,
20260423,solarbe_tech,光伏,57GW项目绝处逢生！美国法院暂停针对风光项目的“歧视性”推迟行动,https://news.solarbe.com/202604/23/50022194.html,2026-04-23 00:00:00,
20260423,tgs4c,综合科技,EQ Piling set for offshore trial at EnBW’s Dreekant site,https://www.tgs4c.com/news/eq-piling-set-for-offshore-trial-at-enbw92s-dreekant-site-nid32698.html,2026-04-23 00:00:00,
20260423,tgs4c,综合科技,Engie in talks over US offshore wind lease refunds,https://www.tgs4c.com/news/engie-in-talks-over-us-offshore-wind-lease-refunds-nid32697.html,2026-04-23 00:00:00,
20260423,tgs4c,综合科技,Nadara submits consent applications for 1.8 GW Bellrock floating wind project,https://www.tgs4c.com/news/nadara-submits-consent-applications-for-1.8-gw-bellrock-floating-wind-project-nid32696.html,2026-04-23 00:00:00,
20260423,china_nengyuan,新能源,准格尔旗一新能源重卡'光储充运'一体化,http://www.china-nengyuan.com/news/246871.html,,
20260423,china_nengyuan,新能源,中节能达坂城100MW/400MWh独立储能项目,http://www.china-nengyuan.com/news/246868.html,,
20260423,china_nengyuan,新能源,一季度甘肃新型储能装机新增131.61万千,http://www.china-nengyuan.com/news/246865.html,,
20260423,china_nengyuan,新能源,荣程新能落子海南自贸港 氢能版图再添,http://www.china-nengyuan.com/news/246862.html,,
20260423,china_nengyuan,新能源,'新型储能产才协同创新中心'在佛山正式,http://www.china-nengyuan.com/news/246858.html,,
20260423,china_nengyuan,新能源,'探索京西开展地下矿井算力工程和重力,http://www.china-nengyuan.com/news/246856.html,,
20260423,china_nengyuan,新能源,2030年全球第一座50MW超热地热发电厂将,http://www.china-nengyuan.com/news/246872.html,,
20260423,china_nengyuan,新能源,Hydrovia™ Energy推出全美氢能加注基础,http://www.china-nengyuan.com/news/246866.html,,
20260423,china_nengyuan,新能源,特斯拉在加州遭遇滑铁卢 Q1销量同比下,http://www.china-nengyuan.com/news/246796.html,,
20260423,china_nengyuan,新能源,'可再生能源 24/7'专题展区展示全天候,http://www.china-nengyuan.com/news/246791.html,,
20260423,china_nengyuan,新能源,东南亚能源转型融资 近九成流向太阳能,http://www.china-nengyuan.com/news/246789.html,,
20260423,china_nengyuan,新能源,中共中央办公厅 国务院办公厅关于更高水平更高质量做好节能降碳,http://www.china-nengyuan.com/news/246734.html,,
20260423,china_nengyuan,新能源,储能'反内卷'启动！融科储能领衔19,http://www.china-nengyuan.com/news/239583.html,,
20260423,china_nengyuan,新能源,中国领衔！2030年绿色经济年产值将,http://www.china-nengyuan.com/news/238728.html,,
20260423,china_nengyuan,新能源,促进压缩空气储能、二氧化碳储能、,http://www.china-nengyuan.com/news/237881.html,,
20260423,china_nengyuan,新能源,国家能源局关于促进新能源集成融合,http://www.china-nengyuan.com/news/237163.html,,
20260423,china_nengyuan,新能源,聚势零碳赛道，共拓生物能源未来！CBC2026第九届中国生物质能源,http://www.china-nengyuan.com/news/245049.html,,
20260423,china_nengyuan,新能源,国家发展改革委 国家能源局关于促,http://www.china-nengyuan.com/news/236981.html,,
20260423,china_nengyuan,新能源,碳达峰碳中和的中国行动,http://www.china-nengyuan.com/news/236913.html,,
20260423,china_nengyuan,新能源,129家！工信部正式公布符合《光伏,http://www.china-nengyuan.com/news/236303.html,,
20260423,china_nengyuan,新能源,《节能降碳中央预算内投资专项管理,http://www.china-nengyuan.com/news/235277.html,,
20260423,china_nengyuan,新能源,2025年中国长时储能装机占全球93%，成本难与锂电竞争,http://www.china-nengyuan.com/news/244142.html,,
20260423,china_nengyuan,新能源,商务部：决定对稀土相关技术实施出,http://www.china-nengyuan.com/news/234848.html,,
20260423,china_nengyuan,新能源,工业和信息化部等八部门关于印发《,http://www.china-nengyuan.com/news/233784.html,,
20260423,china_nengyuan,新能源,碳交易重点领域全覆盖！中共中央办,http://www.china-nengyuan.com/news/232577.html,,
20260423,china_nengyuan,新能源,四川攀枝花：加快抽水蓄能、新型储,http://www.china-nengyuan.com/news/232130.html,,
20260423,china_nengyuan,新能源,ESIE2026要点回顾第二章：重塑,http://www.china-nengyuan.com/news/246559.html,,
20260423,china_nengyuan,新能源,科泰电源涨 7.15%，数据中心备,http://www.china-nengyuan.com/news/246384.html,,
20260423,china_nengyuan,新能源,中国石油首套兆瓦级PEM制氢系,http://www.china-nengyuan.com/news/246387.html,,
20260423,china_nengyuan,新能源,累计推广氢燃料电池汽车4300辆,http://www.china-nengyuan.com/news/246390.html,,
20260423,china_nengyuan,新能源,明阳氢能与西班牙KT公司正式签,http://www.china-nengyuan.com/news/246386.html,,
20260423,china_nengyuan,新能源,国内首款搭载50千瓦级氢转子发,http://www.china-nengyuan.com/news/246392.html,,
20260423,china_nengyuan,新能源,ERA联盟成立：欧洲氢能项目为,http://www.china-nengyuan.com/news/246420.html,,
