date,site,category,title,url,publish_time,content
20260423,ess_news,储能,67.3 GW battery storage progresses through Australia’s grid connection process,https://www.ess-news.com/2026/04/23/67-3-gw-battery-storage-progresses-through-australias-grid-connection-process/,2026-04-23 08:15:00,
20260423,pv_magazine,光伏,EU moves to restrict funding for projects using inverters from high-risk suppliers,https://www.pv-magazine.com/2026/04/23/eu-moves-to-restrict-funding-for-projects-using-inverters-from-high-risk-suppliers/,2026-04-23 16:13:05,
20260423,pv_magazine,光伏,"Sun’s out, load’s gone: The evolution of Australia’s National Electricity Market",https://www.pv-magazine.com/2026/04/23/suns-out-loads-gone-the-evolution-of-australias-national-electricity-market/,2026-04-23 11:34:44,
20260423,pv_magazine,光伏,Solar delivers where wind and hydro falter,https://www.pv-magazine.com/2026/04/23/solar-delivers-where-wind-and-hydro-falter/,2026-04-23 11:26:06,
20260423,pv_magazine,光伏,Solar and wind take over global power growth in 2025,https://www.pv-magazine.com/2026/04/23/solar-and-wind-take-over-global-power-growth-in-2025/,2026-04-23 10:27:47,
20260423,pv_magazine,光伏,Thermoacoustic heat pumps on the verge of commercial breakthrough,https://www.pv-magazine.com/2026/04/23/thermoacoustic-heat-pumps-on-the-verge-of-commercial-breakthrough/,2026-04-23 10:05:58,
20260423,pv_magazine,光伏,Forecasting solar irradiance in urban environments with just one 360° image,https://www.pv-magazine.com/2026/04/23/forecasting-solar-irradiance-in-urban-environments-with-just-one-360-image/,2026-04-23 09:25:07,
20260423,pv_magazine,光伏,Multi-pyranometer tech improves solar irradiance measurements in the Arctic,https://www.pv-magazine.com/2026/04/23/multi-pyranometer-tech-improves-solar-irradiance-measurements-in-the-arctic/,2026-04-23 08:24:06,
20260423,pv_magazine,光伏,Inside PV Manufacturing: Belga Solar’s module factory in Belgium,https://www.pv-magazine.com/2026/04/23/inside-pv-manufacturing-belga-solars-module-factory-in-belgium/,2026-04-23 08:00:14,
20260423,pv_magazine,光伏,Dutch buildings could host 36 GW of façade solar capacity,https://www.pv-magazine.com/2026/04/23/dutch-buildings-could-host-36-gw-of-facade-solar-capacity/,2026-04-23 07:16:43,
20260423,pv_magazine,光伏,EU responds to energy price shocks with ‘homegrown’ clean energy push,https://www.pv-magazine.com/2026/04/23/eu-responds-to-energy-price-shocks-with-homegrown-clean-energy-push/,2026-04-23 06:26:20,
20260423,hydrogen_tech_world,氢,Nel to supply PEM system to Washington utility,https://hydrogentechworld.com/nel-to-supply-pem-system-to-washington-utility,2026-04-23 08:37:49,
20260423,batteries_news,电池,Spain – Navarre and Hithium sign the investment commitment for their battery plant in a ceremony together with President Sánchez,https://batteriesnews.com/spain-navarre-and-hithium-sign-the-investment-commitment-for-their-battery-plant-in-a-ceremony-together-with-president-sanchez-2/,2026-04-23 17:34:29,
20260423,batteries_news,电池,"HPQ Silicon – Industrial Lithium-ion GEN4 21700 Cells Surpass 7,000 mAh — Based on Extended Test Conditions",https://batteriesnews.com/hpq-silicon-industrial-lithium-ion-gen4-21700-cells-surpass-7000-mah-based-on-extended-test-conditions/,2026-04-23 17:31:51,
20260423,batteries_news,电池,Spain – Navarre and Hithium sign the investment commitment for their battery plant in a ceremony together with President Sánchez,https://batteriesnews.com/spain-navarre-and-hithium-sign-the-investment-commitment-for-their-battery-plant-in-a-ceremony-together-with-president-sanchez/,2026-04-23 17:29:11,
20260423,batteries_news,电池,Rivian and Redwood Materials announce energy storage partnership for manufacturing,https://batteriesnews.com/rivian-and-redwood-materials-announce-energy-storage-partnership-for-manufacturing/,2026-04-23 17:27:01,
20260423,batteries_news,电池,TSR Group and BASF cooperate on the recycling of electric vehicle batteries in Europe,https://batteriesnews.com/tsr-group-and-basf-cooperate-on-the-recycling-of-electric-vehicle-batteries-in-europe/,2026-04-23 17:26:38,
20260423,batteries_news,电池,Carmakers navigating the costly and tricky transition to battery storage systems,https://batteriesnews.com/carmakers-navigating-the-costly-and-tricky-transition-to-battery-storage-systems/,2026-04-23 17:22:24,
20260423,batteries_news,电池,GMG Doubles Energy Density of 6 Minute Charging Graphene Aluminium-Ion Battery,https://batteriesnews.com/gmg-doubles-energy-density-of-6-minute-charging-graphene-aluminium-ion-battery/,2026-04-23 17:18:39,
20260423,batteries_news,电池,Voltavate – Manufacturing Breakthrough Gains ARENA Backing to Transform Battery Production at Scale,https://batteriesnews.com/voltavate-manufacturing-breakthrough-gains-arena-backing-to-transform-battery-production-at-scale/,2026-04-23 17:15:09,
20260423,batteries_news,电池,"Ilika, UK pioneer in solid state battery technology, Announces a Collaboration with Brompton Bicycles",https://batteriesnews.com/ilika-uk-pioneer-in-solid-state-battery-technology-announces-a-collaboration-with-brompton-bicycles/,2026-04-23 17:12:36,
20260423,batteries_news,电池,Nornickel seeks new market for palladium in EVs with catalyst for lithium‑sulphur batteries,https://batteriesnews.com/nornickel-seeks-new-market-for-palladium-in-evs-with-catalyst-for-lithium-sulphur-batteries/,2026-04-23 17:12:23,
20260423,techreview_climate,新能源,Will fusion power get cheap? Don’t count on it.,https://www.technologyreview.com/2026/04/23/1136329/fusion-power-cost/,2026-04-23 10:00:00,
20260423,electrek,新能源,"Tesla claims boost Giga Berlin production 20%, but numbers don’t add up",https://electrek.co/2026/04/23/tesla-giga-berlin-production-increase-still-below-capacity/,2026-04-23 23:11:52,
20260423,electrek,新能源,Tesla (TSLA) maxes out $5.8 billion Chinese bank debt facility as China sales crash,https://electrek.co/2026/04/23/tesla-tsla-maxes-out-5-8-billion-chinese-bank-debt-facility-10q/,2026-04-23 22:47:13,
20260423,electrek,新能源,This solar farm almost stalled – Microsoft suppliers helped save it,https://electrek.co/2026/04/23/solar-farm-almost-stalled-microsoft-suppliers-helped-save-it/,2026-04-23 22:31:24,
20260423,electrek,新能源,The EV charger buildout has a weak link – NYC is going after it,https://electrek.co/2026/04/23/the-ev-charger-buildout-has-a-weak-link-nyc-is-going-after-it/,2026-04-23 20:25:13,
20260423,electrek,新能源,"NAVEE 34-mile G5 Pro electric scooter $560 Amazon low, meross smart electrical panel energy monitor $160, more",https://electrek.co/2026/04/23/green-deals-apr-24/,2026-04-23 18:00:00,
20260423,electrek,新能源,Tesla Model YL prototype spotted on US roads for the first time,https://electrek.co/2026/04/23/tesla-model-yl-prototype-spotted-us-roads-first-time/,2026-04-23 12:12:56,
20260423,electrek,新能源,EV fast charging is stabilizing in the US – here’s what changed,https://electrek.co/2026/04/23/ev-fast-charging-is-stabilizing-in-the-us-heres-what-changed/,2026-04-23 12:00:00,
20260423,electrek,新能源,This new ‘pedal-by-wire’ e-bike motor wants to revolutionize electric bikes,https://electrek.co/2026/04/23/this-new-pedal-by-wire-e-bike-motor-wants-to-revolutionize-electric-bikes/,2026-04-23 11:04:41,
20260423,electrek,新能源,Tesla (TSLA) quietly discloses $2 billion AI hardware company acquisition buried in filing,https://electrek.co/2026/04/23/tesla-tsla-quietly-discloses-2-billion-ai-hardware-acquisition-10q/,2026-04-23 10:57:03,
20260423,electrek,新能源,Tesla announces HW4 Plus with doubled memory — will HW4 follow HW3 to the grave?,https://electrek.co/2026/04/23/tesla-hw4-plus-upgrade-will-hw4-follow-hw3/,2026-04-23 09:33:22,
20260423,electrek,新能源,Tesla confirms Cybercab production has started despite delays in unsupervised driving,https://electrek.co/2026/04/23/tesla-cybercab-production-starts-no-nhtsa-2500-vehicle-cap/,2026-04-23 07:09:26,
20260423,electrek,新能源,Tesla pushes Optimus V3 reveal later this year – again,https://electrek.co/2026/04/22/tesla-optimus-production-fremont-model-sx-line/,2026-04-23 00:15:59,
20260423,electrek,新能源,China shipped a record 68 GW of solar in March – here’s why it matters,https://electrek.co/2026/04/22/china-shipped-a-record-68-gw-of-solar-in-march-heres-why-it-matters/,2026-04-23 00:00:00,
20260423,scitechdaily,综合科技,The Simple Habit That Could Help Prevent Cancer,https://scitechdaily.com/the-simple-habit-that-could-help-prevent-cancer/,2026-04-23 23:55:51,
20260423,scitechdaily,综合科技,Forgotten Medicinal Plant Shows Promise in Fighting Dangerous Superbugs,https://scitechdaily.com/forgotten-medicinal-plant-shows-promise-in-fighting-dangerous-superbugs/,2026-04-23 23:30:05,
20260423,scitechdaily,综合科技,"Millions Take These IBS Drugs, But a New Study Finds Serious Risks",https://scitechdaily.com/millions-take-these-ibs-drugs-but-a-new-study-finds-serious-risks/,2026-04-23 23:05:45,
20260423,scitechdaily,综合科技,"5 Common Myths About Learning a New Language, Debunked",https://scitechdaily.com/5-common-myths-about-learning-a-new-language-debunked/,2026-04-23 21:47:42,
20260423,scitechdaily,综合科技,The Neanderthal “Love Story” Isn’t What It Seems,https://scitechdaily.com/the-neanderthal-love-story-isnt-what-it-seems/,2026-04-23 21:22:54,
20260423,scitechdaily,综合科技,"Scientists Unlock Hidden Secrets of 2,300-Year-Old Mummies Using Cutting-Edge CT Scanner",https://scitechdaily.com/scientists-unlock-hidden-secrets-of-2300-year-old-mummies-using-cutting-edge-ct-scanner/,2026-04-23 20:57:16,
20260423,scitechdaily,综合科技,Men vs. Women: Scientists Uncover Dramatic Differences in How the Immune System Ages,https://scitechdaily.com/men-vs-women-scientists-uncover-dramatic-differences-in-how-the-immune-system-ages/,2026-04-23 11:50:28,
20260423,scitechdaily,综合科技,Eating Chili Peppers Linked to Longer Life,https://scitechdaily.com/eating-chili-peppers-linked-to-longer-life/,2026-04-23 11:15:51,
20260423,scitechdaily,综合科技,Bread Might Be Making You Gain Weight Even Without Eating More Calories,https://scitechdaily.com/bread-might-be-making-you-gain-weight-even-without-eating-more/,2026-04-23 10:40:28,
20260423,scitechdaily,综合科技,"4,000-Year-Old Tablets Reveal Lost Magic, Medicine, and Ancient Kings",https://scitechdaily.com/4000-year-old-tablets-reveal-lost-magic-medicine-and-ancient-kings/,2026-04-23 08:36:30,
20260423,scitechdaily,综合科技,AI Meets Quantum Computing and the Predictions Get Scary Accurate,https://scitechdaily.com/ai-meets-quantum-computing-and-the-predictions-get-scary-accurate/,2026-04-23 05:52:57,
20260423,scitechdaily,综合科技,"Wind Farms Are Disrupting Ocean Currents, Moving Millions of Tons of Mud Each Year",https://scitechdaily.com/wind-farms-are-disrupting-ocean-currents-moving-millions-of-tons-of-mud-each-year/,2026-04-23 04:25:48,
20260423,scitechdaily,综合科技,Scientists Discover Massive Magma Reservoir Beneath Tuscany,https://scitechdaily.com/scientists-discover-massive-magma-reservoir-beneath-tuscany/,2026-04-23 03:50:12,
20260423,scitechdaily,综合科技,Scientists Create “Neurobots” – Living Machines With Their Own Nervous Systems,https://scitechdaily.com/scientists-create-neurobots-living-machines-with-their-own-nervous-systems/,2026-04-23 03:15:51,
20260423,interesting_engineering,综合科技,US lab’s ‘Spicy lambs’ protein system cuts rare-earth screening time from years to weeks,https://interestingengineering.com/innovation/llnl-spyclambs-rare-earth-protein-platform,2026-04-23 23:31:26,
20260423,interesting_engineering,综合科技,"US Navy to add 4,500 hypersonic missiles under MACE program by 2031 fleetwide push",https://interestingengineering.com/military/us-navy-4500-hypersonic-missiles-mace-program,2026-04-23 23:30:07,
20260423,interesting_engineering,综合科技,Battery flaw exposed: Why solid-state cells short-circuit under lithium dendrite stress,https://interestingengineering.com/energy/solid-state-batteries-short-circuit-lithium-study,2026-04-23 23:06:53,
20260423,interesting_engineering,综合科技,Scientists build molecular ‘toolbox’ for next-generation advanced electronics,https://interestingengineering.com/innovation/scientists-build-molecular-toolbox-for-next-generation-advanced-electronics,2026-04-23 20:03:21,
20260423,interesting_engineering,综合科技,GPT-5.5 crushes Claude Opus 4.7 in agentic coding with 82.7% terminal-bench score,https://interestingengineering.com/ai-robotics/opanai-gpt-5-5-agentic-coding-gains,2026-04-23 19:32:07,
20260423,interesting_engineering,综合科技,Bill Gates-backed startup boosts US nuclear push with 345–500 MW Wyoming reactor,https://interestingengineering.com/energy/terrapower-kemmerer-nuclear-plant-construction-wyoming,2026-04-23 18:56:06,
20260423,interesting_engineering,综合科技,US’ heat-activated knot robots leap hundreds of times their height without electronics,https://interestingengineering.com/ai-robotics/us-knot-robots-jump-without-electronics,2026-04-23 18:00:00,
20260423,interesting_engineering,综合科技,AI War? White House accuses China of industrial-scale theft of US AI frontier models,https://interestingengineering.com/ai-robotics/ai-war-white-house-accuses-china-of-industrial-scale-theft-of-us-ai-frontier-models,2026-04-23 17:33:04,
20260423,interesting_engineering,综合科技,New solar panels that imitate roof tiles can retain around 95% of their power,https://interestingengineering.com/energy/colored-solar-panels-tiles-roof,2026-04-23 17:16:05,
20260423,cnnpn_domestic,核电国内,共绘能源产业合作新蓝图，中核集团与特变电工签署战略合作协议4月22日，中核集团党组书记、董事长申彦锋在集团公司总部会见了特变电工党委书记、董事长张新一行。双方就深化设备供货、新能源、科技创新等领域合作进行了深入交流，并达成广泛共识。中核集团党组成员、副总经理辛锋，特变电工党委委员，特变电工新疆新能源党委书记、董事长黄汉杰等参加会见。申彦锋对张新一行的到访表示热烈欢迎，并介绍了中核集团近年来的发展情况。他指出，特变电工作为全球输变电行业的领军者，是大国重器的铸造者，以卓越的...2026-04-23,https://www.cnnpn.cn/article/53418.html,2026-04-23 00:00:00,
20260423,cnnpn_domestic,核电国内,中国核建联手中国建研院，共筑核电建造数字化新高地4月22日，中国核建公司党委书记、董事长尹卫平在上海总部会见来访的中国建筑科学研究院有限公司副总经理毛军为一行。双方围绕工程建设、数字化与智能化技术应用、科技创新合作等进行了深入交流。尹卫平对毛军为一行到访表示热烈欢迎，并介绍了中国核建的基本情况与科技创新实践。他表示，双方使命相通、优势互补，期待以此次交流为契机，建立常态化沟通渠道，聚焦民用工程建设、核电工程技术创新、数字化实践等领域深化合作，加快科研成果转化落...2026-04-23,https://www.cnnpn.cn/article/53417.html,2026-04-23 00:00:00,
20260423,cnnpn_domestic,核电国内,核电装机容量同比增长4.8%，国家能源局发布2026年1-3月份全国电力统计数据4月23日，国家能源局发布1-3月全国电力统计数据。截至3月底，全国累计发电装机容量达39.6亿千瓦，同比增长15.5%，其中核电装机容量为6373万千瓦，同比增长4.8%，保持稳定增长态势。作为清洁能源体系的重要支柱，核电在保障电力供应安全、优化能源结构方面持续发挥关键作用。数据显示，1-3月全国新增核电装机容量121万千瓦，同比大幅增长121%，表明核电项目正加速落地、投产节奏加快，为双碳目标提供有力支撑。与此同时，全国发电设备累计平均利用小时数为70...2026-04-23,https://www.cnnpn.cn/article/53416.html,2026-04-23 00:00:00,
20260423,cnnpn_domestic,核电国内,中核矿业科技领导班子调整：金伟任党委书记，推荐任董事长4月22日，中核矿业科技召开干部大会，宣布公司领导班子调整的决定：金伟同志任公司党委书记，推荐任公司董事长。 中核铀业党委书记、董事长袁旭出席会议并讲话。中核铀业副总经济师、人力资源部主任金永吉主持会议并宣读集团公司党组任免决定。2026-04-23,https://www.cnnpn.cn/article/53414.html,2026-04-23 00:00:00,
20260423,cnnpn_domestic,核电国内,田湾核电OT306大修正式结束4月23日，田湾核电3号机组汽轮发电机成功并网，标志着田湾核电2026年度开篇之战——OT306大修安全完成。本次大修是田湾核电基地本年度的首次大修，大修期间，中核运维与田湾核电密切协作，联合中核检修、安徽电建二、中核武汉等协作单位，在大修指挥部统一领导和部署下，深入践行中国核电党建引领、大修卓越党建联建机制，坚持精心组织、精细操作、精益管理，打赢这场田湾基地全年工作定基调、树标杆、开好局的攻坚首战，安全有序完成了九千余项检修任...2026-04-23,https://www.cnnpn.cn/article/53413.html,2026-04-23 00:00:00,
20260423,cnnpn_domestic,核电国内,俄罗斯国家原子能公司为田湾核电站7号机组提供控制系统俄罗斯国家原子能公司自动化控制系统与电气工程事业部下属的仪器工程专业科学研究所(JSC SNIIP)，为位于中国江苏省的田湾核电站7号机组提供了核岛控制和管理系统。作为交付俄罗斯部分的工作内容，该公司专家安装并配置了多个关键系统及组件，包括负责监测和诊断关键反应堆参数、防火、反应堆控制和保护的系统，以及实验室设备和全尺寸模拟器的各个组件。SNIIP股份公司首席执行官阿列克谢·尼基京指出：我们为在中国建设的核电站提供标准化的...2026-04-23,https://www.cnnpn.cn/article/53408.html,2026-04-23 00:00:00,
20260423,cnnpn_domestic,核电国内,中国核建联手中国建研院，共筑核电建造数字化新高地,https://www.cnnpn.cn/article/53417.html,,
20260423,cnnpn_domestic,核电国内,共绘能源产业合作新蓝图，中核集团与特变电工签署战略合作协议,https://www.cnnpn.cn/article/53418.html,,
20260423,cnnpn_domestic,核电国内,核电装机容量同比增长4.8%，国家能源局发布2026年1-3月份全国电力统计数据,https://www.cnnpn.cn/article/53416.html,,
20260423,cnnpn_domestic,核电国内,中核矿业科技领导班子调整：金伟任党委书记，推荐任董事长,https://www.cnnpn.cn/article/53414.html,,
20260423,cnnpn_domestic,核电国内,俄罗斯国家原子能公司为田湾核电站7号机组提供控制系统,https://www.cnnpn.cn/article/53408.html,,
20260423,cnnpn_domestic,核电国内,田湾核电OT306大修正式结束,https://www.cnnpn.cn/article/53413.html,,
20260423,cnnpn_domestic,核电国内,漳州核电4号机组再传捷报 130吨非能动堆腔注水箱模块成功吊装,https://www.cnnpn.cn/article/53404.html,,
20260423,cnnpn_domestic,核电国内,漳州核电3号机组“钢铁心脏”精准就位 316吨压力容器成功完成创新吊装,https://www.cnnpn.cn/article/53402.html,,
20260423,cnnpn_domestic,核电国内,西部超导控股子公司合肥聚能成立 聚焦聚变工程超导线材研发,https://www.cnnpn.cn/article/53387.html,,
20260423,cnnpn_domestic,核电国内,共商先进核能创新发展，第四代核能系统国际论坛年会在海南三亚举办,https://www.cnnpn.cn/article/53398.html,,
20260423,cnnpn_domestic,核电国内,西物院与ITER组织召开深化战略合作第五次协调会,https://www.cnnpn.cn/article/53389.html,,
20260423,cnnpn_domestic,核电国内,中广核“和道”系列自主创新产品正式发布,https://www.cnnpn.cn/article/53399.html,,
20260423,cnnpn_domestic,核电国内,CNEA国际天然铀价格预测指数（2026年04月）,https://www.cnnpn.cn/article/53396.html,,
20260423,cnnpn_domestic,核电国内,深化国际合作 中国原子能董事长率队赴法马通罗曼厂调研交流核燃料技术,https://www.cnnpn.cn/article/53401.html,,
20260423,cnnpn_domestic,核电国内,华东监督站对海阳核电三期核岛底板施工开展从严监督,https://www.cnnpn.cn/article/53386.html,,
20260423,cnnpn_international,核电国外,LS Materials获美国能源公司核聚变项目超级电容器订单4月23日，韩国LS Materials宣布将向一家美国能源公司的核聚变发电商业化示范项目供应超级电容器(UC)，该项目将应用超1000个大型UC模块。LS材料军浦工厂生产线 LS Materials提供LS Materials公司的UC(单相电容器)输出性能极高，能在0.06秒内产生15兆瓦电力，为核聚变装置提供运行所需的瞬时电力，该功率水平可同时满足数千户家庭用电需求。LS Materials解释，此订单意义重大，是首次向核聚变发电领域供货，预计商业化阶段会随更多示范和大规模订单带...2026-04-23,https://www.cnnpn.cn/article/53415.html,2026-04-23 00:00:00,
20260423,cnnpn_international,核电国外,ReNu Industries收购SP Engineering核相关业务据日本经济新闻4月23日报道，位于福岛县大熊町负责核电站退役工作的ReNu Industries宣布，已收购从事核相关业务的SP Engineering(SPE)的业务。ReNu Industries计划通过吸纳SPE的核工程师，组建一支约100人的团队。不过，此次收购价格并未对外披露。据悉，ReNu Industries由风险投资公司Mirai Sozo Investments(位于东京港区)于2025年12月创立。...2026-04-23,https://www.cnnpn.cn/article/53412.html,2026-04-23 00:00:00,
20260423,cnnpn_international,核电国外,日本核燃料公司提交低放射性废物处置相关申请4月22日，日本核燃料有限公司官网发布两则审批动态，该公司向日本原子能规制委员会提交了六所村低放射性废物处置中心废物处置经营许可证变更申请，并且在六所村后处理厂建造新的低放射性废物储存建筑物的计划已获事先批准。此次废物处置经营许可证变更申请主要针对1号废物处理设施的土壤覆盖工艺。变更前，对于1号废物处理设施，1号掩埋设备组开始掩埋后，1至6号掩埋设备组将在35年内(到2027财年)完成，7号和8号掩埋设备组将在43年内(到2035财年)...2026-04-23,https://www.cnnpn.cn/article/53411.html,2026-04-23 00:00:00,
20260423,cnnpn_international,核电国外,国际原子能机构向越南移交核电计划同行评审最终报告2026年4月22日，国际原子能机构副总干事兼核能司司长米哈伊尔·丘达科夫在河内向越南科技部长武海泉正式递交了国际原子能机构第二阶段综合核基础设施审查报告，标志着越南在建立核电计划进程中迈出具体一步2026-04-23,https://www.cnnpn.cn/article/53410.html,2026-04-23 00:00:00,
20260423,cnnpn_international,核电国外,俄罗斯国家原子能公司总经理访土耳其阿库尤核电站 推进建设与合作俄罗斯国家原子能公司总经理阿列克谢·利哈乔夫近日对土耳其阿库尤核电站建设工地进行了工作访问。陪同访问的有阿库尤核电股份公司董事长安东·德杜先科、公司总经理谢尔盖·布茨基赫以及第一副总经理兼技术总监安德烈·茹科夫。访问期间，阿列克谢·利哈乔夫视察了核电站一号机组的建设进度。他指出：我们正朝着今年的主要目标迈进，即确保阿库尤核电站四台机组中第一台机组顺利启动并投入运行。装载燃料组件的冷热试验准备工作已接近尾...2026-04-23,https://www.cnnpn.cn/article/53409.html,2026-04-23 00:00:00,
20260423,cnnpn_international,核电国外,俄罗斯国家原子能公司提出印尼核能发展全面方案近日，在雅加达举行的2026年UGM核能准备论坛上，俄罗斯国家原子能公司(Rosatom)印尼代表处主任安娜·贝洛科涅娃(Anna Belokoneva)发表讲话，提出在印尼发展核能的全面方案。此次论坛出席者众多，包括印尼共和国经济事务统筹部长艾尔朗加·哈塔托(Airlangga Hartarto)、第十二届议会委员会主席班邦·帕蒂贾亚(Bambang Patidjaya)、国家能源委员会成员，以及能源部和国家研究与创新署的代表。论坛重点介绍了俄罗斯国家原子能公司分阶段发展方案...2026-04-23,https://www.cnnpn.cn/article/53407.html,2026-04-23 00:00:00,
20260423,cnnpn_international,核电国外,切尔诺贝利核电站禁区森林可能将污染重新引入生物地球化学循环4月22日，俄罗斯特维尔国立大学(TvSU)动物学与生理学系主任、生物学博士安德烈·季诺维耶夫向塔斯社表示，切尔诺贝利核电站禁区内的森林兼具放射性核素长期储存库与动物栖息地双重属性。安德烈·季诺维耶夫称，火灾、水文状况变化、季节性径流和火山灰输送等因素，都可能将森林中累积的污染物重新引入生物地球化学循环。这意味着切尔诺贝利生态系统的变化并非辐射沉降并消失，而是土壤、木材、火山灰、河流和洪泛区中物质缓慢且波动式重新分...2026-04-23,https://www.cnnpn.cn/article/53406.html,2026-04-23 00:00:00,
