date,site,category,title,url,publish_time,content
20260424,ess_news,储能,Cyprus gives go-ahead to 570 MWh of battery storage,https://www.ess-news.com/2026/04/24/cyprus-gives-go-ahead-to-570-mwh-of-battery-storage/,2026-04-24 13:16:42,
20260424,ess_news,储能,Botswana breaks ground on solar-plus-storage project with 500 MWh battery,https://www.ess-news.com/2026/04/24/botswana-breaks-ground-on-solar-plus-storage-project-with-500-mwh-battery/,2026-04-24 11:10:00,
20260424,pv_magazine,光伏,Israeli storage developer moves into solar EPC with majority stake deal,https://www.pv-magazine.com/2026/04/24/israeli-storage-developer-moves-into-solar-epc-with-majority-stake-deal/,2026-04-24 13:45:35,
20260424,pv_magazine,光伏,UK solar generation hits record 15 GW as gas falls to historic low,https://www.pv-magazine.com/2026/04/24/uk-solar-generation-hits-record-15-gw-as-gas-falls-to-historic-low/,2026-04-24 11:41:05,
20260424,pv_magazine,光伏,Developing El Niño points to stronger solar conditions across Australasia and South Asia,https://www.pv-magazine.com/2026/04/24/developing-el-nino-points-to-stronger-solar-conditions-across-australasia-and-south-asia/,2026-04-24 11:28:44,
20260424,ammonia_energy,氨,Air Liquide: Ammonia cracking in the Port of Antwerp-Bruges,https://ammoniaenergy.org/articles/air-liquide-ammonia-cracking-in-the-port-of-antwerp-bruges/,2026-04-24 05:02:14,
20260424,hydrogen_tech_world,氢,ATOME reaches FID on green fertilizer plant in Paraguay,https://hydrogentechworld.com/atome-reaches-fid-on-green-fertilizer-plant-in-paraguay,2026-04-24 14:16:49,
20260424,electrek,新能源,"Kia cuts EV6 prices by $5,000 on 2026 models",https://electrek.co/2026/04/24/kia-cuts-ev6-prices-by-5000-2026-models/,2026-04-24 23:22:57,
20260424,electrek,新能源,A Florida convention center doubles its solar with no added panels,https://electrek.co/2026/04/24/a-florida-convention-center-doubles-its-solar-with-no-added-panels/,2026-04-24 22:00:01,
20260424,electrek,新能源,ABB E-mobility’s new EV fast charger kills peak power hype,https://electrek.co/2026/04/24/abb-e-mobilitys-new-ev-fast-charger-kills-peak-power-hype/,2026-04-24 20:33:50,
20260424,electrek,新能源,"Podcast: Tesla’s disaster earnings, Beijing Auto Show is mad, new EVs galore",https://electrek.co/2026/04/24/podcast-teslas-disaster-earnings-beijing-auto-show-is-mad-new-evs-galore/,2026-04-24 19:29:40,
20260424,electrek,新能源,"BYD is about to unleash this 1,000+ hp drop-top electric hypercar in Europe [Images]",https://electrek.co/2026/04/24/byd-denza-z-1000-hp-luxury-drop-top-ev-hypercar-images/,2026-04-24 19:28:41,
20260424,electrek,新能源,Gas prices got you down? Learn about EVs this weekend at events countrywide,https://electrek.co/2026/04/24/gas-prices-got-you-down-learn-about-evs-at-drive-electric-events-this-week/,2026-04-24 19:05:00,
20260424,electrek,新能源,"EcoFlow Earth Day sale ends today, Worx 1-acre Vision Cloud robot mower $460 off, Fanttik USB-C pruning shears, more",https://electrek.co/2026/04/24/green-deals-april-24/,2026-04-24 18:00:00,
20260424,electrek,新能源,BYD’s luxury off-road brand unveils first electric sedan and a low-slung sports car [Images],https://electrek.co/2026/04/24/byds-off-road-brand-debuts-first-ev-sedan-and-sports-car-images/,2026-04-24 17:06:03,
20260424,electrek,新能源,BYD upgrades one of its top selling EVs with 5-min flash charging and 390 miles range,https://electrek.co/2026/04/24/byd-upgrades-top-selling-evs-5-min-flash-charging/,2026-04-24 15:37:51,
20260424,electrek,新能源,Kia’s EV sales surged 54% in Q1 with a complete lineup from electric sedans to vans,https://electrek.co/2026/04/24/kias-ev-sales-surge-54-in-q1-with-a-full-lineup-of-sedans-to-vans/,2026-04-24 14:46:16,
20260424,electrek,新能源,"XPeng unveils GX flagship SUV with 750 km range, L4-ready hardware for $58,000",https://electrek.co/2026/04/24/xpeng-gx-flagship-suv-beijing-auto-show-750km-range-58000/,2026-04-24 13:08:18,
20260424,electrek,新能源,"Wheel-E Podcast: Cargo e-bikes, pedal-by-wire, Yozma IN10, laws, more",https://electrek.co/2026/04/24/wheel-e-podcast-cargo-e-bikes-pedal-by-wire-yozma-in10-laws-more/,2026-04-24 12:50:27,
20260424,electrek,新能源,Hyundai unveils sleek new IONIQ V: a production car that looks like a concept,https://electrek.co/2026/04/24/hyundai-ioniq-v-china-600-km-range-auto-china-2026/,2026-04-24 11:20:12,
20260424,electrek,新能源,"Porsche Cayenne Coupe Electric is an off-road capable, 2.4s 0-60mph beauty and beast",https://electrek.co/2026/04/23/porsche-cayenne-coupe-electric-is-an-off-road-capable-2-4s-0-60mph-beauty-and-beast/,2026-04-24 04:00:00,
20260424,electrek,新能源,Interview: we talk home batteries with FranklinWH CEO Gary Lam,https://electrek.co/2026/04/23/interview-we-talk-home-batteries-with-franklin-wh-ceo-gary-lam/,2026-04-24 01:07:14,
20260424,scitechdaily,综合科技,A Common Diabetes Drug May Hold the Key to Stopping HIV From Coming Back,https://scitechdaily.com/a-common-diabetes-drug-may-hold-the-key-to-stopping-hiv-from-coming-back/,2026-04-24 23:51:07,
20260424,scitechdaily,综合科技,Ancient “Syphilis-Like” Disease in Vietnam Challenges Key Scientific Assumptions,https://scitechdaily.com/ancient-syphilis-like-disease-in-vietnam-challenges-key-scientific-assumptions/,2026-04-24 23:16:47,
20260424,scitechdaily,综合科技,Drinking Alcohol To Cope in Your 20s Could Damage Your Brain for Life,https://scitechdaily.com/drinking-alcohol-to-cope-in-your-20s-could-damage-your-brain-for-life/,2026-04-24 22:41:09,
20260424,scitechdaily,综合科技,Scientists Crack Alfalfa’s Chromosome Mystery After Decades of Debate,https://scitechdaily.com/scientists-crack-alfalfas-chromosome-mystery-after-decades-of-debate/,2026-04-24 19:36:06,
20260424,scitechdaily,综合科技,Ancient Ant-Plant Alliance Collapses As Predatory Wasps Move In,https://scitechdaily.com/ancient-ant-plant-alliance-collapses-as-predatory-wasps-move-in/,2026-04-24 19:01:50,
20260424,scitechdaily,综合科技,Scientists Discover Tiny New Spider That Hunts Prey 6x Its Size,https://scitechdaily.com/scientists-discover-tiny-new-spider-that-hunts-prey-6x-its-size/,2026-04-24 18:26:00,
20260424,scitechdaily,综合科技,Natural Component From Licorice Shows Promise for Treating Inflammatory Bowel Disease,https://scitechdaily.com/natural-component-from-licorice-shows-promise-for-treating-inflammatory-bowel-disease/,2026-04-24 15:21:14,
20260424,scitechdaily,综合科技,New Research Finds Shocking Link Between Chili Peppers and Cancer,https://scitechdaily.com/new-research-finds-shocking-link-between-chili-peppers-and-cancer/,2026-04-24 14:46:31,
20260424,scitechdaily,综合科技,Scientists Warn: Popular Sweetener Linked to Dangerous Metabolic Effects,https://scitechdaily.com/scientists-warn-popular-sweetener-linked-to-dangerous-metabolic-effects/,2026-04-24 14:11:20,
20260424,scitechdaily,综合科技,The Most Powerful Neutrino Ever Detected May Have a Surprising Cosmic Source,https://scitechdaily.com/the-most-powerful-neutrino-ever-detected-may-have-a-surprising-cosmic-source/,2026-04-24 11:43:06,
20260424,scitechdaily,综合科技,Newton’s 300-Year-Old Law Passes Its Biggest Cosmic Test Yet,https://scitechdaily.com/newtons-300-year-old-law-passes-its-biggest-cosmic-test-yet/,2026-04-24 11:08:59,
20260424,scitechdaily,综合科技,Monster Storms on Jupiter Unleash Lightning Beyond Anything on Earth,https://scitechdaily.com/monster-storms-on-jupiter-unleash-lightning-beyond-anything-on-earth/,2026-04-24 10:33:01,
20260424,scitechdaily,综合科技,"Scientists Overcome Major Quantum Bottleneck, Potentially Transforming Teleportation and Computing",https://scitechdaily.com/scientists-overcome-major-quantum-bottleneck-potentially-transforming-teleportation-and-computing/,2026-04-24 03:42:56,
20260424,scitechdaily,综合科技,Quantum Physics’ Strangest Problem May Hold the Key to Time Itself,https://scitechdaily.com/quantum-physics-strangest-problem-may-hold-the-key-to-time-itself/,2026-04-24 03:07:39,
20260424,scitechdaily,综合科技,Scientists Create “Liquid Gears” That Spin Without Touching,https://scitechdaily.com/scientists-create-liquid-gears-that-spin-without-touching/,2026-04-24 02:32:42,
20260424,interesting_engineering,综合科技,Meta bets on Amazon’s 3nm Graviton chips with 192 cores for next-gen AI workloads,https://interestingengineering.com/ai-robotics/meta-deploys-amazon-graviton-chips-ai-infrastructure,2026-04-24 23:50:50,
20260424,interesting_engineering,综合科技,Anthropic valued at $350B as Google commits up to $40B in massive new funding,https://interestingengineering.com/ai-robotics/google-40b-anthropic-ai-compute-race,2026-04-24 23:46:27,
20260424,interesting_engineering,综合科技,US Marine Corps seeks new portable attack drone to strike tanks from 15 miles away,https://interestingengineering.com/military/us-marines-opf-m-anti-tank-loitering-munition,2026-04-24 23:15:57,
20260424,interesting_engineering,综合科技,"Sun unleashes back-to-back X-class flares in 7 hours, radio outages hit Earth",https://interestingengineering.com/space/sun-two-x-class-flares-radio-blackout-april-2026,2026-04-24 22:54:57,
20260424,interesting_engineering,综合科技,Stretchable electronic skin lets robotic hand feel touch and pressure signals,https://interestingengineering.com/ai-robotics/flexible-electronics-electronic-skin-soft-robots-turku-study,2026-04-24 19:23:22,
20260424,interesting_engineering,综合科技,"China’s DeepSeek unveils V4 AI model with 1M context window, targets US rivals",https://interestingengineering.com/ai-robotics/deepseek-v4-ai-model-long-context-cost-efficiency,2026-04-24 17:58:28,
20260424,interesting_engineering,综合科技,"Pentagon’s Google Gemini agent designer spawns 103,000 AI tools in five weeks",https://interestingengineering.com/military/pentagon-google-gemini-agent-ai,2026-04-24 17:02:52,
20260424,interesting_engineering,综合科技,CERN switches on 312-foot HiLumi LHC test stand for 10x particle collision boost,https://interestingengineering.com/science/cern-hilumi-particle-collision-boost,2026-04-24 16:19:03,
20260424,cnnpn_domestic,核电国内,无锡首个可控核聚变产业项目安东聚变 Z 箍缩电容器研发中心落户梁溪科技城,https://www.cnnpn.cn/article/53426.html,,
20260424,cnnpn_domestic,核电国内,筑牢核安全文化根基 护航核事业高质量发展,https://www.cnnpn.cn/article/53425.html,,
20260424,cnnpn_domestic,核电国内,2026第五届中国核能高质量发展大会第一轮征文通知,https://www.cnnpn.cn/article/53429.html,,
20260424,cnnpn_domestic,核电国内,开展生态环境法典宣贯 筑牢铀矿冶辐射环境防线,https://www.cnnpn.cn/article/53424.html,,
20260424,cnnpn_domestic,核电国内,打造风光火核储一体化能源基地，国家电网与辽宁省委省政府举行会谈,https://www.cnnpn.cn/article/53423.html,,
20260424,cnnpn_domestic,核电国内,共启先进核能新篇章：国家电投与兰州大学战略签约，组建产学研协同新合力,https://www.cnnpn.cn/article/53422.html,,
20260424,cnnpn_domestic,核电国内,三门核电3号机组凝汽器抽真空试验成功,https://www.cnnpn.cn/article/53421.html,,
20260424,cnnpn_domestic,核电国内,从“手量估算”到“屏显毫厘”：防城港核电大修迎来“毫米级”智慧升级,https://www.cnnpn.cn/article/53420.html,,
20260424,cnnpn_domestic,核电国内,核电装机容量同比增长4.8%，国家能源局发布2026年1-3月份全国电力统计数据,https://www.cnnpn.cn/article/53416.html,,
20260424,cnnpn_domestic,核电国内,中核战略规划研究总院标准化所与法国核电规范标准协会（AFCEN）续签标准化合作备忘录并联合发布RCC标准中文版,https://www.cnnpn.cn/article/53419.html,,
20260424,cnnpn_domestic,核电国内,中国核建联手中国建研院，共筑核电建造数字化新高地,https://www.cnnpn.cn/article/53417.html,,
20260424,cnnpn_domestic,核电国内,田湾核电OT306大修正式结束,https://www.cnnpn.cn/article/53413.html,,
20260424,cnnpn_domestic,核电国内,共绘能源产业合作新蓝图，中核集团与特变电工签署战略合作协议,https://www.cnnpn.cn/article/53418.html,,
20260424,cnnpn_domestic,核电国内,俄罗斯国家原子能公司为田湾核电站7号机组提供控制系统,https://www.cnnpn.cn/article/53408.html,,
20260424,cnnpn_domestic,核电国内,中核矿业科技领导班子调整：金伟任党委书记，推荐任董事长,https://www.cnnpn.cn/article/53414.html,,
20260424,cnnpn_international,核电国外,聚焦先进核能审批与安全监管，美国核监管委员会启动重大机构重组为精简决策流程、整合职能并响应国家安全优先事项，美国核监管委员会(NRC)正在推进机构现代化重组。此次重组将围绕新反应堆、在运反应堆、核材料与核废料三大核心业务领域展开架构调整，旨在以更安全高效的方式支持创新核技术部署。NRC预计将于今年夏季完成此次重组。重组主要包括设立两个新办公室：先进反应堆办公室(OAR)将专注新兴反应堆技术的许可与监管;首席核反应堆监督员办公室(CNRI)将统筹所有在运反应堆的监督工作，其下辖四个地区...2026-04-24,https://www.cnnpn.cn/article/53436.html,2026-04-24 00:00:00,
20260424,cnnpn_international,核电国外,美国核管理委员会批准法马通公司的GAIA和HTP高燃耗核燃料设计方案法马通公司(Framatome)关于压水反应堆(PWR)高燃耗率的专题报告获美国核管理委员会(NRC)批准。这份历时近六年、于2024年提交的文件，涵盖该集团GAIA和HTP燃料设计，在核能行业蓬勃发展背景下，进一步巩固了法马通公司在美国市场的技术地位。该报告是法马通公司先进燃料管理(AFM)项目的一部分，旨在为美国轻水反应堆提供支持。历经六年研发，其目的是支持GAIA和HTP燃料提高燃耗率，提升电厂运营商燃料利用率、安全性和电厂性能。AFM项目采用高浓...2026-04-24,https://www.cnnpn.cn/article/53435.html,2026-04-24 00:00:00,
20260424,cnnpn_international,核电国外,韩国晓星重工与越南签署谅解备忘录，涉及核电设备生产4月23日，在河内JW万豪酒店举行的韩国-越南商业论坛上，晓星重工与越南电力集团(EVN)签署了关于电力资产管理、电网稳定和加强技术能力的谅解备忘录(MOU)。此外，越南还与越南投资促进中心签署了一份谅解备忘录，计划建设一座新的核电站高压电机工厂，这标志着韩国开始扩展越南核电设备市场。2026-04-24,https://www.cnnpn.cn/article/53434.html,2026-04-24 00:00:00,
20260424,cnnpn_international,核电国外,韩越企业签署备忘录 合作推进SMR数据中心供电项目4月23日，韩国电力工程公司(KEPCO工程公司)在河内与越南最大的国有电信公司Viettel集团签署谅解备忘录(MOU)，旨在开发小型模块化反应堆(SMR)项目并开展联合研究合作。图：右为KEPE总裁金泰均，左为越南科学技术研究院(VIST)院长武越进。图片来源：KEPE根据协议，双方将共同推进基于SMR的数据中心供电项目，为Viettel集团运营的越南境内14个数据中心及一个正在建设的大型人工智能数据中心提供稳定电力。此次合作与越南能源政策变化相契合。去年，越...2026-04-24,https://www.cnnpn.cn/article/53433.html,2026-04-24 00:00:00,
20260424,cnnpn_international,核电国外,美国利用超级计算机训练AI模型捕捉等离子体磁湍流细节,https://www.cnnpn.cn/article/53343.html,,
20260424,cnnpn_international,核电国外,Avalanche Energy获DARPA资助 研发核电池攻克聚变能转化难题,https://www.cnnpn.cn/article/53073.html,,
20260424,cnnpn_international,核电国外,俄罗斯国家原子能公司完成世界上第一个放射性废物焚烧项目,https://www.cnnpn.cn/article/53405.html,,
20260424,cnnpn_international,核电国外,AtkinsRéalis确认CANDU® Monark反应堆功率等级,https://www.cnnpn.cn/article/53336.html,,
20260424,cnnpn_international,核电国外,韩国开发出测量核电站设备大气腐蚀新技术,https://www.cnnpn.cn/article/53367.html,,
20260424,cnnpn_international,核电国外,美国安塔瑞斯公司Mark - 0反应堆安全报告获批，试点项目推进,https://www.cnnpn.cn/article/53025.html,,
20260424,cnnpn_international,核电国外,美国核材料公司推超长寿命固态核电池动力单元,https://www.cnnpn.cn/article/53128.html,,
20260424,cnnpn_international,核电国外,Terra Innovatum与Mersen成功生产石墨反应堆堆芯原型,https://www.cnnpn.cn/article/53204.html,,
20260424,cnnpn_international,核电国外,韩越企业签署备忘录 合作推进SMR数据中心供电项目,https://www.cnnpn.cn/article/53433.html,,
20260424,cnnpn_international,核电国外,俄科研人员：月球用核能模块原型机将于2032年问世,https://www.cnnpn.cn/article/53023.html,,
20260424,cnnpn_international,核电国外,Helion Energy：：聚变商用之路迎来关键挑战，材料技术攻坚瞄准“工程极限”,https://www.cnnpn.cn/article/52637.html,,
20260424,cnnpn_international,核电国外,韩国晓星重工与越南签署谅解备忘录，涉及核电设备生产,https://www.cnnpn.cn/article/53434.html,,
20260424,cnnpn_international,核电国外,聚焦先进核能审批与安全监管，美国核监管委员会启动重大机构重组,https://www.cnnpn.cn/article/53436.html,,
20260424,cnnpn_international,核电国外,美国核管理委员会批准法马通公司的GAIA和HTP高燃耗核燃料设计方案,https://www.cnnpn.cn/article/53435.html,,
20260424,cnnpn_international,核电国外,芬兰Steady Energy通讯和公共关系总监Lauri Muranen：到2050年芬兰将有20-30座小型核电站投入运营,https://www.cnnpn.cn/article/52864.html,,
20260424,cpnn_energy,新能源,全球首次！远景ETOP机型通过机舱燃弧与消防同步测试,https://cpnn.com.cn/news/xny/202604/t20260424_1883622.html,2026-04-24 00:00:00,
20260424,cpnn_energy,新能源,全球首次！远景ETOP机型通过机舱燃弧与消防同步测试,http://www.cpnn.com.cn/news/xny/202604/t20260424_1883622.html,2026-04-24 00:00:00,
20260424,cpnn_tech,综合科技,中国发现月球新矿物“镁嫦娥石”,https://cpnn.com.cn/news/kj/202604/t20260424_1883638.html,2026-04-24 00:00:00,
20260424,cpnn_tech,综合科技,中国发现月球新矿物“镁嫦娥石”,http://www.cpnn.com.cn/news/kj/202604/t20260424_1883638.html,2026-04-24 00:00:00,
20260424,sciencenet,综合科技,研究揭示ENSO驱动的跨纬度气候遥相关机制,https://news.sciencenet.cn/htmlnews/2026/4/563665.shtm,2026-04-24 00:00:00,
20260424,sciencenet,综合科技,研发分子骨架“编辑术”助力新药研发与精准合成,https://news.sciencenet.cn/htmlnews/2026/4/563664.shtm,2026-04-24 00:00:00,
20260424,sciencenet,综合科技,我国首个小麦智能设计育种平台iWheat发布,https://news.sciencenet.cn/htmlnews/2026/4/563651.shtm,2026-04-24 00:00:00,
20260424,sciencenet,综合科技,研究为畜牧兽医领域脂肪调控提供新思路,https://news.sciencenet.cn/htmlnews/2026/4/563644.shtm,2026-04-24 00:00:00,
20260424,sciencenet,综合科技,中国科学院第七届科苑名匠发布,https://news.sciencenet.cn/htmlnews/2026/4/563636.shtm,2026-04-24 00:00:00,
20260424,sciencenet,综合科技,古典与爵士乐越来越像流行乐,https://news.sciencenet.cn/htmlnews/2026/4/563630.shtm,2026-04-24 00:00:00,
20260424,xinhua_tech,综合科技,奋楫问天路，逐梦探苍穹,https://www.news.cn/tech/20260424/e4214932c83743f5adbb4e73662e4403/c.html,2026-04-24 00:00:00,
20260424,xinhua_tech,综合科技,迄今规模最大“虚拟宇宙”构建成功,https://www.news.cn/tech/20260424/5f963777f9ee473b8d8e586a15baa423/c.html,2026-04-24 00:00:00,
20260424,xinhua_tech,综合科技,国家知识产权局：完善新兴领域知识产权保护制度,https://www.news.cn/tech/20260424/26b5be1f30c14abc8b569e3fe6999ba6/c.html,2026-04-24 00:00:00,
20260424,xinhua_tech,综合科技,AI乒乓球机器人对战人类高手 谁能赢？,https://www.news.cn/tech/20260424/5b5237a0f59d40ba9bef8415fe5b66fb/c.html,2026-04-24 00:00:00,
20260424,xinhua_tech,综合科技,中国移动“天通+北斗”双星通信服务在全国上线,https://www.news.cn/tech/20260424/7721ec1d9ddb40d6bc67567f88a4c920/c.html,2026-04-24 00:00:00,
20260424,xinhua_tech,综合科技,市场监管总局开展CCC认证守底线专项行动,https://www.news.cn/tech/20260424/21a432e71a8b48478e9df53277942114/c.html,2026-04-24 00:00:00,
20260424,xinhua_tech,综合科技,国家知识产权局已驳回“心机商标”申请127.3万件,https://www.news.cn/tech/20260424/4a1c7224c6af4861b9642daed422887f/c.html,2026-04-24 00:00:00,
20260424,xinhua_tech,综合科技,2026航天文化艺术论坛在成都举办,https://www.news.cn/tech/20260424/b5999a2ea8414163acbfc2003b99f43f/c.html,2026-04-24 00:00:00,
20260424,inen_solar,光伏,陕西渭南市：2026年1月1日起，新能源项目全部参与市场交易,https://solar.in-en.com/html/solar-2459803.shtml,2026-04-24 00:00:00,
20260424,inen_solar,光伏,罗马尼亚环境部长：国家电网难以承受光伏扩张，储能投资迫在眉睫,https://solar.in-en.com/html/solar-2459805.shtml,2026-04-24 00:00:00,
20260424,inen_solar,光伏,国家发展改革委有关负责同志就《碳达峰碳中和综合评价考核办法》答记者问,https://solar.in-en.com/html/solar-2459782.shtml,2026-04-24 00:00:00,
20260424,inen_solar,光伏,云南580MW光伏项目竞配启动,https://solar.in-en.com/html/solar-2459547.shtml,,
20260424,inen_solar,光伏,杨文斌：解构荒漠区光伏电产业与防沙治沙协同发展的新技术、问题,https://solar.in-en.com/html/solar-2459525.shtml,,
20260424,inen_solar,光伏,安徽宿州市：加快新能源集成融合发展，谋划申报绿电直连项目,https://solar.in-en.com/html/solar-2459527.shtml,,
20260424,inen_solar,光伏,开盘大涨84.61%！又一家千亿市值光伏上市企业诞生,https://solar.in-en.com/html/solar-2459534.shtml,,
20260424,inen_solar,光伏,晶澳科技于红伟：漠蓝组件重构沙戈荒光伏核心价值,https://solar.in-en.com/html/solar-2459546.shtml,,
20260424,inen_solar,光伏,本周多晶硅价格跌幅收窄 成交初现回暖,https://solar.in-en.com/html/solar-2459514.shtml,,
20260424,inen_solar,光伏,吉林省白城市政府一行到访中来并达成战略合作,https://solar.in-en.com/html/solar-2459552.shtml,,
20260424,inen_solar,光伏,华能澜沧江公司到华为技术有限公司交流学习并签署深化合作协议,https://solar.in-en.com/html/solar-2459523.shtml,,
20260424,inen_solar,光伏,中车时代电气：2000V光伏逆变器+3450kW储能PCS，沙戈荒大基地的,https://solar.in-en.com/html/solar-2459674.shtml,,
20260424,inen_solar,光伏,谈及清洁能源基地！温枢刚拜会湖北省委书记王忠林,https://solar.in-en.com/html/solar-2459672.shtml,,
20260424,inen_solar,光伏,青海国投与中广核青海公司举行战略合作签约仪式,https://solar.in-en.com/html/solar-2459669.shtml,,
20260424,renewablesnow,新能源,Atome declares FID on green fertiliser plant in Paraguay,https://renewablesnow.com/news/atome-declares-fid-on-green-fertiliser-plant-in-paraguay-1293676/,2026-04-24 00:00:00,
20260424,renewablesnow,新能源,"EBRD sign MoU to work with Jordan on renewables, energy transition",https://renewablesnow.com/news/ebrd-sign-mou-to-work-with-jordan-on-renewables-energy-transition-1293674/,2026-04-24 00:00:00,
20260424,renewablesnow,新能源,Nel narrows net loss in Q1 2026,https://renewablesnow.com/news/nel-narrows-net-loss-in-q1-2026-1293651/,2026-04-24 00:00:00,
20260424,renewablesnow,新能源,Iberdrola wins permits to add 51.3-MW solar farms at Spanish wind farms,https://renewablesnow.com/news/iberdrola-wins-permits-to-add-51-3-mw-solar-farms-at-spanish-wind-farms-1293685/,2026-04-24 00:00:00,
20260424,renewablesnow,新能源,Poland's R.Power signs PPAs with European energy group,https://renewablesnow.com/news/polands-r-power-signs-ppas-with-european-energy-group-1293675/,2026-04-24 00:00:00,
20260424,renewablesnow,新能源,Centrotherm to equip 1.2-GW solar cell production line in Gujarat,https://renewablesnow.com/news/centrotherm-to-equip-1-2-gw-solar-cell-production-line-in-gujarat-1293673/,2026-04-24 00:00:00,
20260424,renewablesnow,新能源,"Offshore wind security gap widens, WindEurope warns",https://renewablesnow.com/news/offshore-wind-security-gap-widens-windeurope-warns-1293681/,2026-04-24 00:00:00,
20260424,renewablesnow,新能源,EIB approves EUR 2bn of clean energy spending across Europe,https://renewablesnow.com/news/eib-approves-eur-2bn-of-clean-energy-spending-across-europe-1293624/,2026-04-24 00:00:00,
20260424,renewablesnow,新能源,Poland's PGE mounting batteries of 981-MWh Zarnowiec BESS,https://renewablesnow.com/news/polands-pge-mounting-batteries-of-981-mwh-zarnowiec-bess-1293662/,2026-04-24 00:00:00,
20260424,renewablesnow,新能源,"L&G, NTR fund acquires 75.4-MWp solar, BESS project in England",https://renewablesnow.com/news/lg-ntr-fund-acquires-75-4-mwp-solar-bess-project-in-england-1293645/,2026-04-24 00:00:00,
20260424,renewablesnow,新能源,Georgia Power files RfP for up to 6 GW of dispatchable generation,https://renewablesnow.com/news/georgia-power-files-rfp-for-up-to-6-gw-of-dispatchable-generation-1293643/,2026-04-24 00:00:00,
20260424,renewablesnow,新能源,Al Yamamah to supply steel towers for 700-MW wind project in Saudi Arabia,https://renewablesnow.com/news/al-yamamah-to-supply-steel-towers-for-700-mw-wind-project-in-saudi-arabia-1293678/,2026-04-24 00:00:00,
