date,site,category,title,url,publish_time,content
20260419,electrek,新能源,Survey Sunday: how much pain at the pump will it take to switch to EV?,https://electrek.co/2026/04/19/survey-sunday-how-much-pain-at-the-pump-will-it-take-to-switch-to-ev/,2026-04-19 18:27:01,
20260419,electrek,新能源,Tesla’s ‘Robotaxi’ expansion looks like another stock pump before earnings,https://electrek.co/2026/04/19/tesla-robotaxi-expansion-dallas-houston-stock-pump-earnings/,2026-04-19 17:34:05,
20260419,electrek,新能源,Tesla owner uses emergency solar to trickle charge after running out of battery in desert,https://electrek.co/2026/04/18/tesla-model-x-solar-charging-atacama-desert-chile-pan-american-highway/,2026-04-19 02:24:22,
20260419,scitechdaily,综合科技,Scientists Say This Overlooked Organ Could Hold the Key to Longer Life,https://scitechdaily.com/scientists-say-this-overlooked-organ-could-hold-the-key-to-longer-life/,2026-04-19 19:14:54,
20260419,scitechdaily,综合科技,Want Less Stress? Landmark Study Points to a Simple Habit,https://scitechdaily.com/want-less-stress-landmark-study-points-to-a-simple-habit/,2026-04-19 18:39:54,
20260419,scitechdaily,综合科技,Scientists Reveal Eating Fruits and Vegetables May Increase Your Risk of Lung Cancer,https://scitechdaily.com/scientists-reveal-eating-fruits-and-vegetables-may-increase-your-risk-of-lung-cancer/,2026-04-19 18:04:53,
20260419,scitechdaily,综合科技,AI Reveals Explosive Growth of Floating Algae Across the World’s Oceans,https://scitechdaily.com/ai-reveals-explosive-growth-of-floating-algae-across-the-worlds-oceans/,2026-04-19 15:53:47,
20260419,scitechdaily,综合科技,5.5 Million Bees Discovered Living Beneath a New York Cemetery,https://scitechdaily.com/5-5-million-bees-discovered-living-beneath-a-new-york-cemetery/,2026-04-19 15:18:33,
20260419,scitechdaily,综合科技,Scientists Reverse Brain Aging With Simple Nasal Spray,https://scitechdaily.com/scientists-reverse-brain-aging-with-simple-nasal-spray/,2026-04-19 14:43:28,
20260419,scitechdaily,综合科技,The Surprising Diet Rule That Makes “Good” Parasites Work,https://scitechdaily.com/the-surprising-diet-rule-that-makes-good-parasites-work/,2026-04-19 11:28:37,
20260419,scitechdaily,综合科技,This Simple Blood Test Could Outperform “Bad Cholesterol” in Preventing Heart Disease,https://scitechdaily.com/this-simple-blood-test-could-outperform-bad-cholesterol-in-preventing-heart-disease/,2026-04-19 10:53:53,
20260419,scitechdaily,综合科技,Scientists Uncover Potential Brain Risks of Popular Fish Oil Supplements,https://scitechdaily.com/scientists-uncover-potential-brain-risks-of-popular-fish-oil-supplements/,2026-04-19 10:18:18,
20260419,scitechdaily,综合科技,Scientists Prove There Are Just Six Degrees of Separation in a Social Network,https://scitechdaily.com/scientists-prove-there-are-just-six-degrees-of-separation-in-a-social-network/,2026-04-19 01:36:19,
20260419,scitechdaily,综合科技,Bee Bacteria Could Fix a Major Flaw in Plant-Based Milk,https://scitechdaily.com/bee-bacteria-could-fix-a-major-flaw-in-plant-based-milk/,2026-04-19 01:01:37,
20260419,scitechdaily,综合科技,Scientists Discover a Surprising Way To Make Bread Healthier and More Nutritious,https://scitechdaily.com/scientists-discover-a-surprising-way-to-make-bread-healthier-and-more-nutritious/,2026-04-19 00:26:16,
20260419,interesting_engineering,综合科技,"China demonstrates microwave beam that recharges drones in flight, continues power delivery",https://interestingengineering.com/military/china-microwave-beam-recharges-drones,2026-04-19 19:12:34,
20260419,interesting_engineering,综合科技,"Scientists run compact free-electron laser for eight hours, cracks FEL stability problem",https://interestingengineering.com/science/scientists-run-compact-free-electron-laser,2026-04-19 17:44:52,
20260419,interesting_engineering,综合科技,China’s PLA considers to use minelaying underwater drones to enforce Taiwan blockade: Report,https://interestingengineering.com/military/china-minelaying-underwater-drone-taiwan,2026-04-19 12:47:53,
20260419,interesting_engineering,综合科技,"1-ton sharks may struggle for survival in waters exceeding 62.6°F, study suggests",https://interestingengineering.com/science/sharks-struggle-in-warm-waters,2026-04-19 11:46:59,
20260419,interesting_engineering,综合科技,US firm’s thorium nuclear fuel bundles move to manufacturing for commercial reactors,https://interestingengineering.com/energy/thorium-based-nuclear-reactor-fuel-advances,2026-04-19 11:33:06,
20260419,interesting_engineering,综合科技,Tesla hits 0% charge in remote Chilean desert as YouTuber uses hood-mounted solar,https://interestingengineering.com/energy/tesla-hit-no-charge-in-remote-desert,2026-04-19 10:35:43,
20260419,interesting_engineering,综合科技,"Humanoid robot surpasses human world record in Beijing half-marathon, clocking 50:26 mins",https://interestingengineering.com/innovation/humanoid-robot-surpasses-human-world-record,2026-04-19 10:00:06,
20260419,cnnpn_domestic,核电国内,秦山核电秦二厂312大修结束4月19日02时39分，秦二厂3号机组成功并网，312大修正式结束。312大修是标准B类大修，任务繁重，按计划完成了燃料更换、一回路设备检查、汽轮机发电机组全面检查、发电机出口断路器全面检查、应急柴油机五年检以及新能标试验等重要工作，同时开展了一回路放化处理、上充泵内泵壳螺钉检查、稳压器电加热器检查更换、柴油机排烟管垫片更换等消缺工作，为机组的下一循环安全稳定运行打下坚实基础。秦二厂312大修是秦山核电本年度的第一个大修，也是十...2026-04-19,https://www.cnnpn.cn/article/53311.html,2026-04-19 00:00:00,
20260419,cnnpn_domestic,核电国内,中国国家报告在《核安全公约》缔约方第十次审议会议上获各方高度肯定,https://www.cnnpn.cn/article/53294.html,,
20260419,cnnpn_domestic,核电国内,我国紧凑型聚变能实验装置（BEST）建设稳步推进,https://www.cnnpn.cn/article/53285.html,,
20260419,cnnpn_domestic,核电国内,国务院新闻办发布会详解“十五五”：可控核聚变纳入重大攻关,https://www.cnnpn.cn/article/53288.html,,
20260419,cnnpn_domestic,核电国内,福建、辽宁核能发电占比超20%,https://www.cnnpn.cn/article/53293.html,,
20260419,cnnpn_domestic,核电国内,中方专家参加国际原子能机构国际核安全顾问委员会2026年春季会议,https://www.cnnpn.cn/article/53275.html,,
20260419,cnnpn_domestic,核电国内,上海将可控核聚变纳入年度双碳重点任务，以“创新联合体”模式攻关前沿技术,https://www.cnnpn.cn/article/53282.html,,
20260419,cnnpn_domestic,核电国内,德国下萨克森州州长奥拉夫·利斯一行来中国科学院合肥研究院等离子体所访问交流,https://www.cnnpn.cn/article/53273.html,,
20260419,cnnpn_domestic,核电国内,秦山核电秦二厂312大修结束,https://www.cnnpn.cn/article/53311.html,,
20260419,cnnpn_domestic,核电国内,中核华兴党委书记、董事长周博拜访中广核研究院有限公司,https://www.cnnpn.cn/article/53291.html,,
20260419,cnnpn_domestic,核电国内,瞄准B1类科研｜电投数科与南瑞集团深化核电工控安全及电力市场仿真合作,https://www.cnnpn.cn/article/53274.html,,
20260419,cnnpn_domestic,核电国内,宁德核电建设提速，5、6号机组管廊桥防火涂装项目落定,https://www.cnnpn.cn/article/53280.html,,
20260419,cnnpn_domestic,核电国内,中越联合声明：探讨加强核安全领域交流合作,https://www.cnnpn.cn/article/53269.html,,
20260419,cnnpn_domestic,核电国内,“暖核一号”（荣成）首个核能供暖季圆满结束,https://www.cnnpn.cn/article/53272.html,,
20260419,cnnpn_domestic,核电国内,共筑核电建造数智化创新生态，长三角国家技术创新中心到访中国核建,https://www.cnnpn.cn/article/53270.html,,
20260419,cnnpn_domestic,核电国内,三澳核电厂1号机组2027年起参与电力市场交易,https://www.cnnpn.cn/article/53268.html,,
20260419,cnnpn_international,核电国外,阿根廷展示地区核能领导力，聚焦小型堆技术合作与能力建设阿根廷在国际原子能机构于巴拉圭亚松森举办的第二届小型模块化反应堆学校上，再次展现其在拉丁美洲核技术领域的领先地位。此次会议汇集了地区各国代表、国际组织和行业人士，围绕小型模块化反应堆这一未来能源领域备受看好的技术展开交流，并推动相关能力建设。阿根廷代表团由核事务秘书费德里科·拉莫斯·纳波利率领。他表示，阿根廷凭借数十年来积累的核工业经验，已具备从设计、工程到运营和燃料循环的完整能力，能够为刚刚起步的国家提供技...2026-04-19,https://www.cnnpn.cn/article/53309.html,2026-04-19 00:00:00,
20260419,cnnpn_international,核电国外,埃及积极研究与俄罗斯国家原子能公司合作建设小型模块化反应堆埃及正式开启核能领域的新议程，研究与俄罗斯国家原子能公司合作建设小型模块化核反应堆(SMR)。这一动向与达巴(Dabaa)核电站项目的推进同步展开，源于埃及政府与俄方举行的一系列高层会议。开罗方面表示，希望扩大双方在核能领域的合作，并探索这类技术在埃及本土落地的可能性。最近的会谈不仅关注达巴核电站的建设进展，这座电站总装机容量约4800兆瓦，被视为非洲规模最大的核电项目之一;双方也开始讨论更灵活的新一代核能技术，其中重点就是小...2026-04-19,https://www.cnnpn.cn/article/53307.html,2026-04-19 00:00:00,
20260419,cnnpn_international,核电国外,俄罗斯研发出新型核反应堆保护系统，可抵御电网断相故障俄罗斯新西伯利亚国立技术大学近日获得一项专利，涉及用于核反应堆应急保护系统控制部件垂直运动的电驱动装置。该设备旨在提升核反应堆在紧急情况下的可靠性，减少误报警，并增强整套报警与控制系统的稳定性。在核电站中，保护与控制系统负责调节吸收中子的控制棒，以维持链式反应稳定运行，或在危险发生时迅速停堆。一旦这一系统失效，哪怕只有短短几秒，也可能增加堆芯过热甚至放射性泄漏的风险。因此，控制棒驱动机构的可靠性被视为核安全中的关键...2026-04-19,https://www.cnnpn.cn/article/53306.html,2026-04-19 00:00:00,
20260419,cnnpn_international,核电国外,巴西海军核安全与质量秘书处参加国际原子能机构应急研讨会，提升核事故响应能力4月13日至17日，巴西海军核安全与质量秘书处(SecNSNQ)在里约热内卢参加了由国际原子能机构举办、巴西国家核安全局支持的国际研讨会，主题是加强核与放射性紧急事件中的通报、沟通和援助机制。本次活动采用强化培训的形式，注重实际操作，汇集了多个国家的代表，旨在提升应急处置能力，协调各国响应安排，并加深与国际原子能机构相关公约工具的应用能力。培训也为学员参与ConvEx等国际演练做好准备，以持续完善应急响应体系。SecNSNQ此次派出了行动...2026-04-19,https://www.cnnpn.cn/article/53304.html,2026-04-19 00:00:00,
20260419,cnnpn_international,核电国外,南非Necsa小型模块化反应堆项目引关注南非核能公司(Necsa)计划中的小型模块化反应堆(SMR)示范项目，在为潜在供应商举行强制性情况介绍会后，吸引了国际和国内的广泛关注。此次会议是Necsa近期发布的意向书(EOI)相关活动，该意向书于3月底发布，提交截止日期为2026年5月29日。共有来自12个国家(包括南非)的54位潜在合作伙伴参加了简报会。Necsa集团首席执行官Loyiso Tyabashe称，此次会议意义重大，为澄清公司小型模块化反应堆项目在技术、商业和战略方面的问题提供了重要契机。他表...2026-04-19,https://www.cnnpn.cn/article/53286.html,2026-04-19 00:00:00,
20260419,cnnpn_international,核电国外,Spie France与EDF签约 保障比热核电站ICEDA设施IT安全近日，Spie France近日与法国电力公司(EDF)签署合同，负责保障比热核电站ICEDA设施的IT系统安全。合同中，Spie Nucléaire担任项目经理，Spie ICS负责工业网络安全，Spie Industrie负责SCADA设备日志记录。当下，IT和OT专业知识融合已成为关键基础设施网络安全的必要结构性要求。监控法国核设施的IT系统受重要运营商监管义务约束，是重点关注对象。但控制这些设施的运营技术(OT)架构，仍是受监管行业中最易出现未解决漏洞的领域之一。ICEDA设2026-04-19,https://www.cnnpn.cn/article/53261.html,2026-04-19 00:00:00,
20260419,cnnpn_international,核电国外,捷克共和国顺利通过了《核安全公约》第十次审议大会《核安全公约》第十次审议大会于2026年4月13日至24日在国际原子能机构维也纳总部召开。此类审议大会每三年定期举办一次，意味着历时数月的国家报告编制工作告一段落，随后将由公约其他缔约方进行评估，其中包括书面问答环节。捷克共和国通过国家核安全委员会主席什捷潘·科赫内克(Štěpán Kochánek)向成员国代表提交了国家核安全方案，介绍了最新进展与当前计划。该方案获得了成员国代表的积极评价。成员国代表尤其关...2026-04-19,https://www.cnnpn.cn/article/53260.html,2026-04-19 00:00:00,
20260419,cnnpn_international,核电国外,德国政界就重启核电站争论不休近期，德国政界围绕重启核电站展开激烈讨论，尽管公众舆论普遍支持重启核电，但政治领域分歧依旧明显。据《明镜周刊》等德国媒体报道，当地时间15日，基督教民主联盟(基民盟)和基督教社会联盟(基社盟)组成的中间偏保守执政联盟的议会领袖延斯·施潘结束党内创新会议后称，研究显示，投资90亿至100亿欧元(约合15.7万亿至17.4万亿韩元)，重启近年来停运的核电站可行。他指出，重启成本远低于新建核电站预计的300亿至500亿欧元(52.2万亿至87万亿韩元)，并...2026-04-19,https://www.cnnpn.cn/article/53257.html,2026-04-19 00:00:00,
20260419,cnnpn_international,核电国外,中越联合声明：探讨加强核安全领域交流合作,https://www.cnnpn.cn/article/53269.html,,
20260419,cnnpn_international,核电国外,Avalanche Energy获DARPA资助 研发核电池攻克聚变能转化难题,https://www.cnnpn.cn/article/53073.html,,
20260419,cnnpn_international,核电国外,韩国原子能研究院转让“高效加压真空流体输送系统”技术,https://www.cnnpn.cn/article/53013.html,,
20260419,cnnpn_international,核电国外,Terra Innovatum与Mersen成功生产石墨反应堆堆芯原型,https://www.cnnpn.cn/article/53204.html,,
20260419,cnnpn_international,核电国外,美国核材料公司推超长寿命固态核电池动力单元,https://www.cnnpn.cn/article/53128.html,,
20260419,cnnpn_international,核电国外,韩国核动力船舶开发等四项目入选最终研发初步可行性研究,https://www.cnnpn.cn/article/53019.html,,
20260419,cnnpn_international,核电国外,俄科研人员：月球用核能模块原型机将于2032年问世,https://www.cnnpn.cn/article/53023.html,,
20260419,cnnpn_international,核电国外,美国安塔瑞斯公司Mark - 0反应堆安全报告获批，试点项目推进,https://www.cnnpn.cn/article/53025.html,,
20260419,cnnpn_international,核电国外,阿根廷展示地区核能领导力，聚焦小型堆技术合作与能力建设,https://www.cnnpn.cn/article/53309.html,,
20260419,cnnpn_international,核电国外,俄罗斯研发出新型核反应堆保护系统，可抵御电网断相故障,https://www.cnnpn.cn/article/53306.html,,
20260419,cnnpn_international,核电国外,埃及积极研究与俄罗斯国家原子能公司合作建设小型模块化反应堆,https://www.cnnpn.cn/article/53307.html,,
20260419,cnnpn_international,核电国外,巴西海军核安全与质量秘书处参加国际原子能机构应急研讨会，提升核事故响应能力,https://www.cnnpn.cn/article/53304.html,,
20260419,cnnpn_international,核电国外,德国政界就重启核电站争论不休,https://www.cnnpn.cn/article/53257.html,,
20260419,cnnpn_international,核电国外,南非Necsa小型模块化反应堆项目引关注,https://www.cnnpn.cn/article/53286.html,,
20260419,cnnpn_international,核电国外,西班牙核能监管机构批准尤兹巴多（Juzbado）核燃料厂至少延运十年,https://www.cnnpn.cn/article/53310.html,,
20260419,sciencenet,综合科技,2026年科学突破奖公布,https://news.sciencenet.cn/htmlnews/2026/4/563330.shtm,2026-04-19 00:00:00,
20260419,sciencenet,综合科技,2026全国科技活动周和全国科技工作者日即将举办,https://news.sciencenet.cn/htmlnews/2026/4/563325.shtm,2026-04-19 00:00:00,
20260419,sciencenet,综合科技,极小种群野生植物云南梧桐4个谱系面临不同气候风险,https://news.sciencenet.cn/htmlnews/2026/4/563324.shtm,2026-04-19 00:00:00,
20260419,sciencenet,综合科技,联合国教科文组织“科学十年”倡议启动会在京举行,https://news.sciencenet.cn/htmlnews/2026/4/563321.shtm,2026-04-19 00:00:00,
20260419,sciencenet,综合科技,昆明植物所澄清六籽苏铁复合群物种界定,https://news.sciencenet.cn/htmlnews/2026/4/563320.shtm,2026-04-19 00:00:00,
20260419,sciencenet,综合科技,研究人员制定极小种群野生植物朱红大杜鹃保护策略,https://news.sciencenet.cn/htmlnews/2026/4/563319.shtm,2026-04-19 00:00:00,
20260419,sciencenet,综合科技,短暂天气过程导致南极海冰快速减退,https://news.sciencenet.cn/htmlnews/2026/4/563317.shtm,2026-04-19 00:00:00,
20260419,sciencenet,综合科技,崇明岛河道样本中发现硅藻门新物种,https://news.sciencenet.cn/htmlnews/2026/4/563307.shtm,2026-04-19 00:00:00,
20260419,sciencenet,综合科技,云南发现八角属新种睡莲八角,https://news.sciencenet.cn/htmlnews/2026/4/563304.shtm,2026-04-19 00:00:00,
20260419,sciencenet,综合科技,鲨鱼难逃“双重困境”,https://news.sciencenet.cn/htmlnews/2026/4/563302.shtm,2026-04-19 00:00:00,
20260419,sciencenet,综合科技,马克斯·普朗克-中国科学院合成生物化学联合研究中心在深揭牌,https://news.sciencenet.cn/htmlnews/2026/4/563294.shtm,2026-04-19 00:00:00,
20260419,inen_solar,光伏,18位能源监管机构负责人发文，划定6大光伏新能源红线与方向指引,https://solar.in-en.com/html/solar-2459457.shtml,,
20260419,inen_solar,光伏,中天合创乌审旗风光制氢一体化项目光伏发电工程正式开工,https://solar.in-en.com/html/solar-2459464.shtml,,
20260419,inen_solar,光伏,云南580MW光伏项目竞配启动,https://solar.in-en.com/html/solar-2459547.shtml,,
20260419,inen_solar,光伏,国家能源集团签约湖南绿电直连项目,https://solar.in-en.com/html/solar-2459463.shtml,,
20260419,inen_solar,光伏,杨文斌：解构荒漠区光伏电产业与防沙治沙协同发展的新技术、问题,https://solar.in-en.com/html/solar-2459525.shtml,,
20260419,inen_solar,光伏,“光核”联动！国内最大海上光伏项目再传捷报,https://solar.in-en.com/html/solar-2459453.shtml,,
20260419,inen_solar,光伏,开盘大涨84.61%！又一家千亿市值光伏上市企业诞生,https://solar.in-en.com/html/solar-2459534.shtml,,
20260419,inen_solar,光伏,晶澳科技于红伟：漠蓝组件重构沙戈荒光伏核心价值,https://solar.in-en.com/html/solar-2459546.shtml,,
20260419,inen_solar,光伏,量产效率超25.2%！Fellow Energy携自主专利产品Jupiter电池与组,https://solar.in-en.com/html/solar-2459566.shtml,,
20260419,inen_solar,光伏,国务院：用林、用草等事项实现统一受理，对无序竞争产业可暂停核,https://solar.in-en.com/html/solar-2459562.shtml,,
20260419,china_nengyuan,新能源,中国力量推动长时储能蓬勃发展,http://www.china-nengyuan.com/news/246508.html,,
20260419,china_nengyuan,新能源,宁波见证中国从'制造'迈向'智造',http://www.china-nengyuan.com/news/246506.html,,
20260419,china_nengyuan,新能源,2026年'沿着釜溪看发展·盐都新动能'主,http://www.china-nengyuan.com/news/246505.html,,
20260419,china_nengyuan,新能源,氢燃料电池应用于南极,http://www.china-nengyuan.com/news/246504.html,,
20260419,china_nengyuan,新能源,克州江理矿产资源及氢能开发与利用研究,http://www.china-nengyuan.com/news/246503.html,,
20260419,china_nengyuan,新能源,'氢'风拂古城 西安加快氢能产业发展,http://www.china-nengyuan.com/news/246502.html,,
20260419,china_nengyuan,新能源,一季度钒电池交付平稳过渡 二季度静待,http://www.china-nengyuan.com/news/246458.html,,
20260419,china_nengyuan,新能源,ERA联盟成立：欧洲氢能项目为何难落地,http://www.china-nengyuan.com/news/246420.html,,
20260419,china_nengyuan,新能源,消息称零跑汽车在意大利大卖,http://www.china-nengyuan.com/news/246414.html,,
20260419,china_nengyuan,新能源,程婷婷：排斥中国风电企业是英国'战略,http://www.china-nengyuan.com/news/246330.html,,
20260419,china_nengyuan,新能源,欧美多国电动汽车销量在3月份大增 美国,http://www.china-nengyuan.com/news/246322.html,,
20260419,china_nengyuan,新能源,【综述】2026全球木屑颗粒市场报告：创记录强劲增长，重大变革将,http://www.china-nengyuan.com/news/242830.html,,
20260419,china_nengyuan,新能源,中国领衔！2030年绿色经济年产值将,http://www.china-nengyuan.com/news/238728.html,,
20260419,china_nengyuan,新能源,促进压缩空气储能、二氧化碳储能、,http://www.china-nengyuan.com/news/237881.html,,
20260419,china_nengyuan,新能源,国家能源局关于促进新能源集成融合,http://www.china-nengyuan.com/news/237163.html,,
20260419,china_nengyuan,新能源,国家发展改革委 国家能源局关于促,http://www.china-nengyuan.com/news/236981.html,,
20260419,china_nengyuan,新能源,从过剩转向紧张！2025年储能电芯出货量跃升95%至612GWh,http://www.china-nengyuan.com/news/242737.html,,
20260419,china_nengyuan,新能源,碳达峰碳中和的中国行动,http://www.china-nengyuan.com/news/236913.html,,
20260419,china_nengyuan,新能源,129家！工信部正式公布符合《光伏,http://www.china-nengyuan.com/news/236303.html,,
20260419,china_nengyuan,新能源,《节能降碳中央预算内投资专项管理,http://www.china-nengyuan.com/news/235277.html,,
20260419,china_nengyuan,新能源,商务部：决定对稀土相关技术实施出,http://www.china-nengyuan.com/news/234848.html,,
20260419,china_nengyuan,新能源,人工智能数据中心增长5倍！2030年亚洲将面临100GW的电力激增,http://www.china-nengyuan.com/news/242648.html,,
20260419,china_nengyuan,新能源,工业和信息化部等八部门关于印发《,http://www.china-nengyuan.com/news/233784.html,,
20260419,china_nengyuan,新能源,碳交易重点领域全覆盖！中共中央办,http://www.china-nengyuan.com/news/232577.html,,
20260419,china_nengyuan,新能源,四川攀枝花：加快抽水蓄能、新型储,http://www.china-nengyuan.com/news/232130.html,,
20260419,china_nengyuan,新能源,跃升：我国新能源汽车产业加速提质,http://www.china-nengyuan.com/news/231834.html,,
20260419,china_nengyuan,新能源,2025年全球可再生能源装机达到,http://www.china-nengyuan.com/news/246166.html,,
20260419,china_nengyuan,新能源,中国石油首套兆瓦级PEM制氢系,http://www.china-nengyuan.com/news/246387.html,,
20260419,china_nengyuan,新能源,累计推广氢燃料电池汽车4300辆,http://www.china-nengyuan.com/news/246390.html,,
20260419,china_nengyuan,新能源,明阳氢能与西班牙KT公司正式签,http://www.china-nengyuan.com/news/246386.html,,
20260419,china_nengyuan,新能源,AIDC储能与电力相关上市企业年,http://www.china-nengyuan.com/news/246283.html,,
20260419,china_nengyuan,新能源,国内首款搭载50千瓦级氢转子发,http://www.china-nengyuan.com/news/246392.html,,
20260419,china_nengyuan,新能源,科泰电源涨 7.15%，数据中心备,http://www.china-nengyuan.com/news/246384.html,,
20260419,china_nengyuan,新能源,全球生物质能源网改版公告,http://www.china-nengyuan.com/news/230690.html,,
20260419,china_nengyuan,新能源,全球首部液流电池百科全书—《中国液,http://www.china-nengyuan.com/news/210064.html,,
20260419,china_nengyuan,新能源,【重要】《中国氢能产业大全 2023-冬,http://www.china-nengyuan.com/news/192299.html,,
20260419,china_nengyuan,新能源,《氢能产业大全 2020》正式发布！,http://www.china-nengyuan.com/news/160270.html,,
20260419,china_nengyuan,新能源,大华股份2025年营收超327亿元 AI大模型技术价,http://www.china-nengyuan.com/news/246509.html,,
20260419,china_nengyuan,新能源,PPIH公布创纪录的2025财年第四季度及全年业绩,http://www.china-nengyuan.com/news/246507.html,,
20260419,china_nengyuan,新能源,定义安全新高度：华宝新能成为移动电源新国标,http://www.china-nengyuan.com/news/246500.html,,
20260419,china_nengyuan,新能源,科达新能源：聚焦储能赛道 推动增资扩产,http://www.china-nengyuan.com/news/246498.html,,
20260419,china_nengyuan,新能源,中国储能出海热潮背后：铝塑膜的需求密码,http://www.china-nengyuan.com/news/246496.html,,
20260419,china_nengyuan,新能源,山大电力研发台区专用EMS系统助力'百兆瓦广域,http://www.china-nengyuan.com/news/246495.html,,
